Nº;Pasta;Título;Página;Letra
1;1;Aguardo o Dia;18;"Aguardo o dia que verei No céu a luz mais forte que o Sol O céu se abrir e ver descer Jesus Em majestade força e poder Tristeza e choro não existirão Sofrer e morte lá não entrarão Na eternidade com meu Salvador pra sempre adorarei ao meu Senhor! Virá o rei Jesus! Meu coração deseja vê-lo! Em Sua presença pra sempre estar! Aguardo o dia em que Ele vem nos buscar! E junto aos santos me unirei Louvor eterno ali entoarei Tua luz a tudo iluminará, pra sempre ó Deus então governarás! Virá o rei Jesus! Meu coração deseja vê-lo! Em Sua presença pra sempre estar! Aguardo o dia que Ele vem...! Virá o rei Jesus! Meu coração deseja vê-lo! Em Sua presença pra sempre estar! Aguardo o dia em que Ele vem nos buscar! Sua vinda aguardo eu cantando; meu lar no céu; Seus passos hei de ouvir soando além do escuro véu. Passarinhos, belas flores, querem m’encantar; São vãos terrestres esplendores mas contemplo o meu lar! Virá o rei Jesus! Meu coração deseja vê-lo! Em Sua presença pra sempre estar! Aguardo o dia que Ele vem...! Virá o rei Jesus! Meu coração deseja vê-lo! Em Sua presença pra sempre estar! Aguardo o dia em que Ele vem nos buscar! "
2;1;Aguenta Firme;19;Aguenta firme, não desista, continue a lutar! As crises e as dores acontecem, Mas chega uma hora aonde elas têm seu fim. Se você não desistir, é pra minha inspiração, Pra também permanecer, fiel e firme! Eu tô contando contigo, Deus tá contando com a gente. O céu inteiro se move, Pra ver a gente vencer. [2x] Eu só peço ao meu Senhor, Que entre bem na minha frente e abençoe tua vida! E te faça tão feliz agarrado em Sua presença, Cure as tuas feridas, e te faça vencedor E te dê a alegria, de ver toda tua casa, derramada aos Seus pés. Aguenta firme, não desista! (2x) Se você não desistir, é pra minha inspiração, Pra também permanecer, fiel e firme! Eu tô contando contigo, Deus tá contando com a gente. O céu inteiro se move, Pra ver a gente vencer. [3x]    
3;1;Além do Rio Azul;20;Além do rio azul as ruas são de ouro e de cristais Ali tudo é vida, ali tudo é paz Morte e choro... Nunca mais! Tristeza e dor...Nunca mais! Além do rio azul as ruas são de ouro e de cristais Ali tudo é vida, ali tudo é paz Morte e choro... Nunca mais! Tristeza e dor... Nunca mais! Verei o grande rio da vida claro como o cristal Verei a face do meu mestre querido! Não haverá mais noite ali! Não haverá nenhum clamor! Verei os olhos de Jesus e tocarei Seu corpo enfim! [2x] As nações andarão na Sua luz e as portas jamais se fecharão! A cidade é de ouro puro, de jaspe é seu muro, além do rio azul! Morte e choro, tristeza e dor nunca mais! Nunca mais! (3x)     
4;1;Amigo Espírito Santo;21;Solo: Espírito Santo, meu Consolador Espírito Santo, sabes quem eu sou! E mesmo assim se importas comigo! E mesmo assim, Vocal: (E mesmo assim) Solo: Moras em mim... Vocal: (Espírito Santo!) Todos: Tu és Santo, Tu és Santo! Que outra palavra se faz necessária pra Te descrever? Tu és Santo, Tu és Santo! Procuro palavras pra Te descrever, Espírito Santo! Solo: Amigo, abrigo, renovo, consolo, Todos: Espírito Santo de Deus! Solo: Que fala comigo, que ora por mim com gemidos inexprimíveis! Em todos momentos vem me convencer Todos: que sou dependente Solo: de Deus! Todos: ÔÔÔÔÔ... Solo: Não Te afaste de mim, Não Te retires de mim! Todos: ÔÔÔÔÔ... Todos: Não Te afaste de mim! Não Te retires de mim! Solo: Espírito Santo! (2x) Todos: Tu és Santo, Tu és Santo! Que outra palavra se faz necessária pra Te descrever? Tu és Santo, Tu és Santo! Procuro palavras pra Te descrever, Espírito Santo!   
5;1;Até Tocar o Céu;22;Até tocar o céu... Até tocar o céu... Vou te buscar, vou te adorar até tocar o céu! [2x] É tempo de vigiar e orar É tempo de buscar a face de Deus É tempo de receber a Sua direção e o Seu poder! É tempo de se levantar e agir É tempo de ampliar a visão É tempo de se arrepender e clamar pelo Seu perdão! É tempo de viver a realidade de uma vida de temor e santidade Com os olhos espirituais abertos pois a vinda de Jesus esta muito perto! É tempo de parar de murmurar, de abrir a boca para abençoar! Porque somos os profetas desse tempo, somos a geração do avivamento! Geração que denuncia o pecado mas ama o pecador Geração que abre mão de tudo por causa do Senhor Geração que não tolera Jezabel! Geração que ora como Daniel! Geração que busca a Deus... Até tocar o céu! Até tocar o céu... Vou te buscar, vou te adorar até tocar o céu!    
6;1;Braços de Amor;23;Pode ser que alguém venha te fazer chorar... Pode ser que esse alguém seja quem mais você amar! De quem menos se espera pode vir a traição Mas somente em Jesus se encontra amor com perfeição! Ele deu a vida por você, Ele te ama pra valer! Nele você pode confiar, Com Ele você pode contar! Tudo o que Ele faz é por amor, não por interesse ou por favor! Nunca vai te decepcionar, mas as suas lágrimas Ele vem enxugar! Mesmo se você errar, está pronto a te perdoar! Na alegria ou na dor, sempre está contigo seja onde for! Não te deixa caído, mas te carrega em Seus braços de amor! De quem menos se espera pode vir a traição Mas somente em Jesus se encontra amor com perfeição! Ele deu a vida por você, Ele te ama pra valer! Nele você pode confiar, Com Ele você pode contar! Tudo o que Ele faz é por amor, não por interesse ou por favor! Nunca vai te decepcionar, Mas as suas lágrimas Ele vem enxugar! Mesmo se você errar, está pronto a te perdoar! Na alegria ou na dor, sempre está contigo seja onde for! Não te deixa caído, mas te carrega em Seus braços de amor! (2x)    
7;1;Calvário;24;"No Calvário meu Senhor um sacrifício fez por mim Se entregou como um Cordeiro por amor Toda dor Ele sofreu... o Seu corpo a sangrar... Alto preço Ele pagou em meu lugar! A coroa em Sua cabeça a perfurar! Os cravos em Suas mãos a transpassar! O último suspiro ali na cruz! Jesus morreu... Oh... Oh... Oh... Oh... A esperança se acabou, tudo em trevas se tornou A tristeza gera lágrimas no olhar... Mas um milagre aconteceu e a alegria renasceu! Ao terceiro dia Cristo ressurgiu! E a esperança brotou em cada olhar, O Rei dos reis vivo está! Jesus sobre a morte triunfou! E vivo está! (3x) Jesus sobre a morte triunfou E Ele está vivo! Vivo! E Ele está vivo! Vivo! Ao terceiro dia vivo! Vivo! Vivo! Vivo! Ele foi ferido por causa das nossas transgressões, E esmagado por causa das nossas iniquidades; O castigo que nos traz a paz estava sobre Ele, E pelas Suas pisaduras fomos sarados Eu sei... Ele morreu mas a morte não o prendeu! Porque ao terceiro dia... Ao terceiro dia... Ao terceiro dia, vivo! Vivo! Jesus sobre a morte triunfou! "
8;1;Consagração;25;Ao Rei dos reis consagro tudo o que sou... De gratos louvores transborda o meu coração! A minha vida eu entrego nas Tuas mãos, meu Senhor! Pra Te exaltar com todo meu amor! Eu Te louvarei conforme a Tua justiça E cantarei louvores, pois Tu és Altíssimo! Celebrarei a Ti ó Deus, com meu viver! Meninas: Cantarei e contarei as Tuas obras! Pois por Tuas mãos foram criados terra, céu e mar e todo ser que neles há! Toda a terra celebra a Ti com cânticos de júbilo! Pois Tu és o Deus Criador! [2x] Celebrarei a Ti ó Deus, com meu viver! Meninas: Cantarei e contarei as Tuas obras! Pois por Tuas mãos foram criados terra, céu e mar e todo ser que neles há! Toda a terra celebra a Ti com cânticos de júbilo! Pois Tu és o Deus Criador! [2x] Pois Tu és o Deus Criador! A honra! A glória! A força! E o poder ao Rei Jesus! E o louvor ao Rei Jesus! [3x]   
9;1;Consolador;26;Consolador, não sai daqui Meu peito dói, minha alma chora se Tu sair! Consolador, mora em mim Sinto um vazio quando estou longe de Ti... Perdoa o meu coração Das vezes que errei sem perceber Mas não afaste Sua presença Seus frutos me fazem viver Quando minha alma se cansou fostes minha força pra seguir! Quando meu coração calou fostes Intercessor, o meu Ajudador, o meu Consolador fiel! Consolador, não sai daqui Meu peito dói, minha alma chora se Tu sair! Consolador, mora em mim Sinto um vazio quando estou longe de Ti... Perdoa o meu coração Das vezes que errei sem perceber Mas não afaste Sua presença Seus frutos me fazem viver    
10;1;Cresça;27;Solo: Senhor não quero ser refém de mim mesmo, venha me salvar! Mesmo que eu seja alguém que eu não venha me vangloriar! Crucifico o meu ego pra que Tu cresças sobre mim, Me esvazio dos meus ideais, quero transbordar mais de Ti! Solo: Senhor, me escondo em Tua graça e no Teu amor, Me esconda em cavernas se preciso for! Não quero estar em evidência se não for pra Tua glória e pro Teu louvor! Senhor, blindado em Tua verdade está o meu coração O meu fascínio está além da multidão! Rejeito Babilônia, seus manjares e os altares da corrupção! Cresça, até que o meu eu desapareça, Até a Tua glória me cobrir! Quero Tua presença exalando em mim, Que eu diminua e o Senhor cresça! Que o Teu nome esteja sempre em evidência E Tua glória eternamente permaneça! Senhor que eu venha diminuir E a Tua glória vá além de mim! (Ô...Ô...Ô...Ô...Ô...Ô) (Ô...Ô...Ô...Ô...Ô...Ô...Ô) (2x) Todos: Cresça, até que o meu eu desapareça, Até a Tua glória me cobrir! Quero Tua presença exalando em mim, que eu diminua e o Senhor cresça! Que o Teu nome esteja sempre em evidência e Tua glória eternamente permaneça! Senhor que eu venha diminuir Solo: E a Tua glória vá além de mim! Todos: Do pó, do barro formastes o homem feito em Tuas mãos, Criador tão nobre! Eles não têm, não possuem, não são! É só a caneta, És o autor da canção! Nem fama, nem palco, nem honra, nem aplausos traduzem o preço na cruz que foi pago! A renúncia existe, vai na contramão, Nós somos só a voz que anuncia a salvação, Tesouros em vasos de barro pra que a excelência seja Tua, Brilhando o farol e sendo Tua luz nas ruas mais escuras! Ninguém rouba Tua glória! Ninguém toma o Teu trono! Ai daquele que mexe e troca manjares por honra... Da Igreja És o Dono! Que sopra e erga Teu nome, Que venha a justiça e o Teu reino! Que a glória da cruz confronte com os grandes e caiam de joelhos, Solo: Somos o pincel, Só Tu És o artista! Que eu diminua e o Senhor cresça, cresça... Todos: Cresça, até que o meu eu desapareça, Até a Tua glória me cobrir! Quero Tua presença exalando em mim, que eu diminua e o Senhor cresça! Que o Teu nome esteja sempre em evidência e Tua glória eternamente permaneça! Senhor que eu venha diminuir Solo: E a Tua glória vá além de mim! Cresça, até que o meu eu desapareça, Até a Tua glória me cobrir! Quero Tua presença exalando em mim, que eu diminua e o Senhor cresça! Que o Teu nome esteja sempre em evidência e Tua glória eternamente permaneça! Senhor que eu venha diminuir Solo: E a Tua glória vá além de mim! Todos: Cresça!       
11;1;Digno é o Senhor;29;Graças eu Te dou, Pai pelo preço que pagou Sacrifício de amor que me comprou, Ungido do Senhor! Pelos cravos em Tuas mãos graças eu Te dou, ó meu Senhor! Lavou minha mente e coração, me deu perdão, restaurou-me a comunhão! Digno é o Senhor! Sobre o trono está Soberano, Criador vou sempre Te adorar! Elevo minhas mãos ao Cristo que venceu Cordeiro de Deus morreu por mim... Mas ressuscitou! Digno é o Senhor! Pelos cravos em Tuas mãos graças eu Te dou, ó meu Senhor! Lavou minha mente e coração, me deu perdão, restaurou-me a comunhão! Digno é o Senhor! Sobre o trono está Soberano, Criador vou sempre Te adorar! Elevo minhas mãos ao Cristo que venceu Cordeiro de Deus morreu por mim... Mas ressuscitou! Digno é o Senhor! Mas ressuscitou! Digno é o Senhor Mas ressuscitou! Digno é o Senhor     
12;1;Esperança;30;Solo: Eu vejo naquela cruz que um dia morreu por mim O meu Senhor pra me salvar Hoje posso Todos: Te exaltar pra sempre Todos: És para mim a esperança da minha vida, É Jesus meu Senhor Tua graça alcançou-me! Sempre vou Te buscar! Sempre vou Te buscar, Uôô! Meninas: Eu vejo naquela cruz que um dia morreu por mim O meu Senhor pra me salvar Hoje posso Todos: Te exaltar pra sempre... Para Sempre! Todos: És para mim a esperança da minha vida É Jesus meu Senhor Tua graça alcançou-me! [2x] Sempre vou Te buscar! Sempre vou Te buscar, Uôô... (2x) Só Tu És meu Redentor o meu Socorro Sempre vou anunciar Tua palavra [2x] Todos: És para mim a esperança da minha vida É Jesus meu Senhor Tua graça alcançou-me! Sempre vou Te buscar! Sempre vou Te buscar, Uôô... (2x) Todos: Só Tu És meu Redentor o meu Socorro Sempre vou anunciar Tua palavra Tua palavra (4x) ôôôô, ôôôô, ôôô...ô   
13;1;Estou em Tuas Mãos;31;Não te desanimes, Não temas mal algum! A luta logo passa E a alegria cedo vem Tem alguém chamado Cristo, Sempre vai te consolar! Se o coração está ferido Levante as mãos e diz: Eu sei que tudo posso... Eu posso suportar! Não importa o que me aconteça Estou em Tuas mãos! Com Cristo tudo posso... Eu posso suportar! Não importa o que me aconteça Estou em Tuas mãos! E quando a luta vem Parecendo não ter fim... E logo seus amigos Querem te abandonar Tem alguém chamado Cristo, Sempre vai te consolar! Se o coração está ferido Levante as mãos e diz: Eu sei que tudo posso... Eu posso suportar! Não importa o que me aconteça Estou em Tuas mãos! Com Cristo tudo posso...Eu posso suportar! Não importa o que me aconteça Estou em Tuas mãos! E quando a luta vem Parecendo não ter fim... E logo seus amigos Querem te abandonar Tem alguém chamado Cristo, Sempre vai te consolar! Se o coração está ferido Levante as mãos e diz: Eu sei que tudo posso... Eu posso suportar! Não importa o que me aconteça Estou em Tuas mãos! Com Cristo tudo posso... Eu posso suportar! Não importa o que me aconteça Estou em Tuas mãos! (3x)   
14;1;Estou Pronto;32;Estou pronto, sempre pronto, Totalmente submisso a Ti Estou deixando tudo para trás, Todo meu ser Entrego a Ti Solo: Com tudo o que sou vem me usar! Minha vida te dou E o meu coração Todos: (meu coração) Pois eu senti Senhor Morreste por mim Todos: Minha vida mudou, Hoje eu posso dizer Estou pronto, sempre pronto, Totalmente submisso a Ti Estou deixando tudo para trás, Todo meu ser Entrego a Ti Solo: Ninguém me falou que seria fácil, Eu iria chorar Mas eu recebi (o Seu poder) Minha fraqueza Em força Ele transformou Todos: Minha vida mudou, Hoje eu posso dizer Estou pronto, sempre pronto, Totalmente submisso a Ti Estou deixando tudo para trás, Todo meu ser Entrego a Ti Ô,ô,ô... A luta vai chegar (estou pronto), Deus vai te usar (pronto) Deus vai operar (pronto.... Pronto), Você pode até chorar (pronto) Deus vai te usar (estou pronto), Ele vai operar (pronto) Ele vai operar em você (estou pronto) Tudo que eu quero E o que preciso E tudo que sou Entrego a Ti Te dou minha vida E o meu coração Te dou! (Te dou!) (3x) Entrego a Ti! Estou pronto, sempre pronto, Totalmente submisso a Ti Estou deixando tudo para trás, Todo meu ser Entrego a Ti 
15;1;Eu me Rendo;33;Eis me aqui, prostrado outra vez Pra tudo entregar... (2x) Leva-me, perto de Ti, Senhor! Anseio por Ti... (2x) Eu me rendo... Enche-me, da graça e do Teu amor Sacia meu ser... (2x) Abraça-me, ouve o meu clamor! Fala pra mim... (2x) Eu me rendo! Eu me rendo! Pra conhecer-Te mais! Pra conhecer-Te mais! [2x] Então vem me incendiar, Meu coração é o Teu altar! Quero ouvir o som do céu, Tua glória contemplar! [2x] Te damos honra! Te damos glória! Teu é o poder Pra sempre amém... [2x] Eu me rendo! Eu me rendo! Pra conhecer-Te mais! Pra conhecer-Te mais! [2x] Vento de poder, sopra em meu viver Faz Teu querer! Faz Teu querer, em mim! Como um vendaval, sobrenatural Faz Teu querer! Faz Teu querer, em mim! (3x) 
16;1;Faça Morada;34;Solo: Eis-me aqui, tantas fraquezas diante da Tua grandeza O que se vê o coração sente, o corpo responde, minha alma não mente Sonda agora este coração, Veja, Senhor, se não tenho razão! Mas eu não quero ser tão racional, Espírito Santo, pode se achegar E fazer morada! e fazer morada! Vocal: (ôôôô...) Espírito Santo, mora em mim! Vocal: (ô..ô..ô..ô..ô..) Todos: O meu coração é o Teu lugar, Solo: faça morada! Solo: Eu Te convido a nunca mais me deixar aqui... Todos: Faça morada em mim! (3x) Todos: Eis-me aqui, tantas fraquezas diante da Tua grandeza O que se vê o coração sente, o corpo responde, minha alma não mente Sonda agora este coração, Veja, Senhor, se não tenho razão! Mas eu não quero ser tão racional, Espírito Santo, pode se achegar Todos: E fazer morada! E fazer morada! Solo: Espírito Santo, mora em mim! Vocal: (ôôôôô...) Todos: O meu coração é o Teu lugar, Solo: faça morada! Solo: Eu Te convido a nunca mais me deixar aqui... Todos: Faça morada em mim! (3x) Solo: O meu coração é o Teu lugar... Vocal: (Faça morada em mim (2x) em... Mim ) Solo: O meu coração é o Teu lugar, faça morada! Eu Te convido a nunca mais me deixar aqui... Vocal: (ôôôôô...) Todos: O meu coração é o teu lugar... Faça morada em mim! Faça morada em mim! Faça morada em mim!  
17;1;Geração de Samuel;35;Eu faço parte de um novo tempo Que está nascendo em minha nação Eu sou um fruto de uma semente Que foi plantada há muito tempo atrás por meus irmãos! [2x] A geração de Samuel está se levantando em todo lugar! (3X) Geração que depõe Saul, Geração que unge Davi (2x) Para um tempo de louvor Geração que depõe Saul, Geração que unge Davi (2x) Para um tempo de louvor (2x) A geração de Samuel está se levantando em todo lugar! (2X) Geração que depõe Saul, Geração que unge Davi (4x) Para um tempo de louvor (9x)      
18;1;Hosana;36;Cordeiro de Deus que dos céus desceu Muito além do véu quero te adorar Se encham meus lábios com teu louvor Hosana, pra sempre ao Rei dos reis! (2x) [2x] No teu lugar santo me faz entrar Meu advogado perante o Pai Ofereço minha vida em louvor a Ti Hosana, pra sempre Te adorarei! (2x) [2x] Das dores da vida amarga livrou-me Encheu-me do Espírito Santo de Deus Só existe louvor onde Tu estás! (2x) Falar face a face com o Leão! E ver em Seu rosto o brilho do sol! E junto com os anjos louvar a Ti Hosana, pra sempre Te adorarei! (4x) Hosana pra sempre! Hosana pra sempre e sempre e sempre... (4x) E sempre e sempre e sempre e sempre! Hosana pra sempre! Hosana pra sempre! Te amo! Hosana! Te louvo! Hosana! Te amo! Hosana! (4x) Te adoro! Hosana! (4x)   
19;1;Incomparável Deus;37;Incomparável Deus, mui digno de louvor Em Tuas mãos está todo poder! Nada pode escapar da Tua grandeza, Nem mesmo um pequeno fio de cabelo Incomparável Grandioso Deus! [2x] Tua voz é mais doce que o mel Teu olhar é ternura e amor Me envolves de misericórdia confortando o meu coração! Incomparável Grandioso Deus! Porque Tu És, Hoje eu posso te adorar! Porque Tu És, Em Tua mesa tenho lugar! Me destes autoridade Teu governo em meus ombros está! Incomparável Grandioso Deus! [2x] Incomparável És! Incomparável És! Ser mais semelhante a Jesus é o desejo do meu coração! Incomparável És! [2x]     
20;1;Jesus meu Guia é;38;Jesus meu guia é, Amigo e protetor! Ele é o meu bom Pastor E quando eu sentir temor... Nele confiarei! Nele confiarei! Fraco sou, mas Deus me dá Seu poder, Seu amor! Jesus meu guia é, Amigo e protetor! Ele é o meu bom Pastor! E quando eu sentir temor... Nele confiarei! (Jesus meu guia é) Nele confiarei! (Amigo e protetor, Ele é...) Fraco sou mas Deus me dá (O meu bom Pastor) Seu poder seu amor (E quando eu sentir temor) Nele confiarei! Nele confiarei! Fraco sou, mas Deus me dá Seu poder, Seu amor! Jesus meu guia é, Amigo e protetor! Ele é o meu bom Pastor E quando eu sentir temor... Nele confiarei (Jesus meu guia é) Nele confiarei (Amigo e protetor, Ele é...) Fraco sou mas Deus me dá (O meu bom Pastor) Seu poder, Seu amor (E quando eu sentir temor) Nele confiarei! Nele confiarei! Fraco sou mas Deus me dá Seu poder seu amor [2X]    
21;1;Mestre;39;Solo: Mestre... tem lugar em minha casa se quiser Já bateu em tantas portas que nem sei, ó Rei dos reis! Mestre... não pensei que fosse à casa de um plebeu, Ainda mais alguém humilde como eu, ó grande Rei! Já que veio é bem-vindo em meu viver Vocal: (Uh... Uh... Uh...) Faça Sua esta casa, ó meu Rei! Vocal: (Uh... Uh... Ah...) E a faça santa, santa, santa, santa Vocal: (santa, santa, santa, santa) e santo eu serei! Grandioso e Santo, Santo, Santo... Vocal: (Santo, Santo, Santo) Ó Deus altíssimo habita em mim! Solo: Eu fui uma casa onde muita coisa entrou Só eu sei o quanto o coração chorou, mas Deus mudou! Quando permiti que Ele entrasse em meu viver Fiz mudanças que jamais imaginei realizar! Minha casa é minha vida e dei pra Deus Vocal: (Uh... Uh... Uh...) Ó Senhor, como quiser vem transformar! Vocal: (Uh... Uh... Ah...) E a faça santa, santa, santa, santa Vocal: (santa, santa, santa, santa) e santo eu serei! Grandioso e Santo, Santo, Santo... Vocal: (Santo, Santo, Santo) Ó Deus altíssimo habita em mim! E a faça santa, santa, santa, santa Vocal: (santa, santa, santa, santa) e Todos: santo eu serei! (Sim, eu serei) Grandioso e Santo, Santo, Santo... Vocal: (Santo, Santo, Santo) Ó Deus altíssimo habita em mim! Todos : (Oh... Oh... Oh...) Amém! 
22;1;Minha Pequena Luz;40;Minha pequena luz, eu vou deixar brilhar (3x) Brilhar, deixar brilhar, deixar brilhar Por onde quer que eu vá, eu vou deixar brilhar (3x) Brilhar, deixar brilhar, deixar brilhar! Uma luz, esperança viva na voz e no coração Linda luz que acende e mexe todo fogo da inspiração! Que traz a força e faz continuar a força da liberdade Por isso a minha luz vai brilhar! Minha pequena luz, eu vou deixar brilhar (3x) Brilhar, deixar brilhar, deixar brilhar! Na minha vida eu vou, eu vou deixar brilhar (3x) Brilhar, deixar brilhar, deixar brilhar! Uma luz, esperança viva na voz e no coração Linda luz que acende e mexe todo fogo da inspiração! Que traz a força e faz continuar a força da liberdade Por isso a minha luz vai brilhar! Minha pequena luz, eu vou deixar brilhar (3x) Brilhar, deixar brilhar, deixar brilhar! A minha luz eu vou deixar brilhar! (3x) Por onde quer que eu vá!    
23;1;Nunca Pare de Lutar;41;Em tempos de guerra, nunca pare de lutar! Não baixe a guarda, nunca pare de lutar! Em tempos de guerra, nunca pare de adorar! Libera a Palavra, profetiza sem parar! O escape, o descanso, a cura, a recompensa vem sem demora! (4x) O que vem pra tentar ferir o valente de Deus em meio às suas guerras? Que ataque é capaz de fazê-lo olhar pra trás e querer desistir? Que terrível arma é usada pra tentar paralisar sua fé? Cansaço, desânimo logo após uma vitória A mistura de um desgaste com um contra-ataque do mal A dor de uma perda, ou a dor da traição Uma quebra de aliança, que é a raiz da ingratidão Se alguém está assim, preste muita atenção Ouça o que vem do coração de Deus! Em tempos de guerra, nunca pare de lutar! Não baixe a guarda, nunca pare de lutar! Em tempos de guerra, nunca pare de adorar! Libera a Palavra, profetiza sem parar! O escape, o descanso, a cura, a recompensa vem sem demora!(4x)    
24;1;Planos de Deus;42;Bem sei eu que tudo podes... E nenhum dos Teus planos pode se frustrar! A vontade é Tua e a minha vida em Tuas mãos está E nenhum dos Teus planos pode se frustrar! (2x) Não se frustrarão, não se frustrarão! Os planos de Deus ninguém impedirá! Pode o vento soprar, a Terra pode se abalar! Mas os planos de Deus ninguém impedirá! Bem sei eu que tudo podes... E nenhum dos Teus planos pode se frustrar! A vontade é Tua e a minha vida em Tuas mãos está! E nenhum dos Teus planos pode se frustrar! Oh... Oh... Oh... Não se frustrarão, não se frustrarão! Os planos de Deus ninguém impedirá! Pode o vento soprar, a Terra pode se abalar! Mas os planos de Deus ninguém impedirá! Ninguém pode te ajudar! Ninguém pode te levantar! Mas se Deus tem um plano contigo ninguém impedirá! Solo: Quando passares pelas águas Todos: Eu estarei contigo, filho... Solo: Quando passares pelo fogo, ele não te queimará! Todos: Pois Eu estou contigo, filho! Eu estou contigo, filho! Eu estou contigo, filho! Eu estou contigo! E se teu barco parecer que vai naufragar, Está balançando pra lá e pra cá! Está causando medo em teu coração Está causando dúvidas... Cadê Jesus? Mas olha só quem vem aí andando sobre as águas! Parece que é Jesus andando sobre as águas! Está dando uma ordem para o vento! Sou Eu Dono do tempo, Sou Eu Dono daqui, Sou Eu Dono do mar! Sou Eu! (3x) Sou Eu...! E se teu barco parecer que vai naufragar, Está balançando pra lá e pra cá! Está causando medo em teu coração Está causando dúvidas... Cadê Jesus? Mas olha só quem vem aí andando sobre as águas! Parece que é Jesus andando sobre as águas! Está dando uma ordem para o vento! Sou Eu Dono do tempo, Sou Eu Dono daqui, Sou Eu Dono do mar! Sou Eu! (3x) Sou Eu...! Ninguém pode te ajudar! Ninguém pode te levantar! Mas se Deus tem um plano contigo ninguém impedirá!        
