Nº;Pasta;Título;Página;Letra
114;4;Estátua;134;Levanta! (9x) Levantou! Pula! (9x) Pulou! Dança! (9x) Dançou! Roda! (9x) Rodou! Eu quero ver uma estátua diferente uma estátua inteligente Pula! (9x) Pulou! Eu quero ver quem aqui constrói uma estátua de super herói Roda, roda, roda, roda que legal Eu quero ver agora uma estátua de animal Pula, pula, pula, pula, pula, pula Eu quero ver agora uma estátua bonita parecendo capa de revista Dança, dança, dança, dança criançada Eu quero ver agora uma estátua engraçada Pula, pula, pula, pula e sai do chão Eu quero ver uma estátua fazendo coração Dança, dança, dança, dança, dança, dança Eu quero ver agora uma estátua sorrindo Uma estátua que parece estar dormindo Acorda! (9x) Acordou! Pula! (9x) Pula, estátua! Dança! (9x) Estátua! Roda! (9x) Estátua! Mão na cabeça, mão nas orelhas, mão nas bochechas, mão no nariz, mão na barriga, mão no joelho, Estátua! Batendo o pé no chão, palma com a mão, o pé no chão, palma com a mão, Estátua! Pula, pula, pula, pula, pula, pula Eu quero ver quem é que fica sem se mexer Dança, dança, dança, pula, pula, pula, roda, roda, roda Pedi pra parar, parou! Pedi pra sentar, sentou! 
115;4;Eu li na Bíblia;135;Oh, uh, oh, uh, oh... Oh, uh, oh, uh, oh... Eu li na Bíblia e vou contar pra você que com Jesus você pode vencer! Você fica valente, fica obediente, Se vem o mal, você vence porque... Não tem medo de cara feia não! Deus te dá forças pra matar leão! Se Davi venceu até gigante, mesmo pequenininho você pode ser... Forte e corajoso como Sansão! Amigo de Deus como Abraão! Muito inteligente como Salomão! Você pode ser o que quiser, use a sua fé! [2x] Oh, uh, oh, uh, oh... Oh, uh, oh, uh, oh... Eu li na Bíblia e vou contar pra você que com Jesus você pode vencer! Você fica valente, fica obediente, Se vem o mal, você vence porque... Não tem medo de cara feia não! Deus te dá forças pra matar leão! Se Davi venceu até gigante, mesmo pequenininho você pode ser... Forte e corajoso como Sansão! Amigo de Deus como Abraão! Muito inteligente como Salomão! Você pode ser o que quiser, use a sua fé! [2x] Lute, lute, lute como Davi lutou! Dance, dance, dance como Miriã dançou! Grite, grite, grite como Josué gritou e derrube as muralhas na força do Senhor! [2x] Forte e corajoso como Sansão! Amigo de Deus como Abraão! Muito inteligente como Salomão! Você pode ser o que quiser, use a sua fé! [2x] Lute, lute, lute como Davi lutou! Dance, dance, dance como Miriã dançou! Grite, grite, grite como Josué gritou e derrube as muralhas na força do Senhor! [2x] Forte e corajoso como Sansão! Amigo de Deus como Abraão! Muito inteligente como Salomão! Você pode ser o que quiser, use a sua fé! [2x] Você pode ser o que quiser, use a sua fé!  
116;4;Hey Pai!;136;Eu sei que nunca me deixou, eu sei que sempre esteve aqui comigo Livrando o meu coração do que não é Seu! E eu sei que, todas as noites, Tu vens, pra acalmar a minha mente E pondo no meu coração que eu sou Teu! Tchu-ru-ru... (2x) Hey Pai, olhando pra Você me lembro bem Das noites que passei e que lutei aqui Pensando estar sozinho, sem ninguém por perto Eu, mesmo tão sozinho, não desanimei Pois sabia que cuidarias de mim mesmo sem eu merecer, me daria Sua mão! Tchu-ru-ru... Eu sei que nunca me deixou, eu sei que sempre esteve aqui comigo Livrando o meu coração do que não é Seu! E eu sei que, todas as noites, Tu vens, pra acalmar a minha mente E pondo no meu coração que eu sou Teu! Tchu-ru-ru... (2x)      
117;4;Medley: (O Nosso General É Cristo, Os Guerreiros Se Preparam, Firme nas Promessas);137;"Pelo Senhor marchamos sim, o Seu exército poderoso é! Sua glória será vista em toda a terra! Vamos cantar o canto da vitória, Glória a Deus! Vencemos a batalha Toda arma contra nós perecerá! O nosso General é Cristo, seguimos os Seus passos Nenhum inimigo nos resistirá! [2x] Os guerreiros se preparam para a grande luta É Jesus o Capitão, que avante os levará. A milícia dos remidos marcha impoluta; Certa que a vitória alcançará! Eu quero estar com Cristo, onde a luta se travar, No lance imprevisto Na frente m’encontrar. Até que O possa ver na glória, Se alegrando da vitória, Onde Deus vai me coroar! Jesus! Jesus! Jesus! Jesus! Firme! Firme! Firme nas promessas de Jesus, meu Mestre Firme! Firme! Sim, firme nas promessas de Jesus. Firme! Firme! Firme nas promessas de Jesus, meu Mestre Firme! Firme... Sim, firme nas promessas de Jesus. "
118;4;Meu Herói;138; O meu Herói não é um herói de brinquedo O meu Herói não é um herói de papel O meu Herói não é um desenho animado igual aquele que assisti na TV O meu herói não usa máscara negra nem espinafre como força e poder! O meu Herói não se disfarça em nada nem se esconde atrás de uma TV! O meu Herói é Todo-Poderoso! Ele é mais forte que o Super Man É só orar que Ele aparece Vem rapidinho pra me socorrer! Jesus é meu Herói! (3x) E vai me proteger! Jesus é meu Herói! (3x) Com Ele eu vou vencer! O meu Herói é Todo-Poderoso Ele é o filho do Grande Deus! Não usa martelo, mas Sua palavra É uma espada com muito poder! Jesus é meu Herói! (3x) E vai me proteger! Jesus é meu Herói! (3x) Com Ele eu vou vencer! 
119;4;O Céu é Muito Bom;139;Melhor que chocolate, melhor do que bombom, Melhor que pirulito, o céu é muito bom! [2x] Um lugar com tesouros e ruas de ouro, É lá que um dia eu vou morar! Um lago limpinho, feito de cristal! Lá é muito lindo, lá é tão legal! Melhor que chocolate, melhor do que bombom, Melhor que pirulito, o céu é muito bom! [2x] Pra sempre brincando, pra sempre cantando! É lá que um dia eu vou morar! [2x] Melhor que chocolate, melhor do que bombom, Melhor que pirulito, o céu é muito bom! [2x] Um lugar com tesouros e ruas de ouro, É lá que um dia eu vou morar! Um lago limpinho, feito de cristal! Lá é muito lindo, lá é tão legal! Melhor que chocolate, melhor do que bombom, Melhor que pirulito, o céu é muito bom! [2x]   
120;4;O Herói é Jesus;140;Não existe homem morcego Não existe homem de ferro É tudo história de quadrinhos Os verdadeiros estão na Bíblia O Batman não é de nada O Super Man não tem poder para salvar Isso é tudo conto de fadas Sobre grandes heróis eu vou contar Davi era um menino muito dedicado a Deus Ele não tinha lança nem espada em suas mãos Ele rasgava o urso e o leão só num instante Usava uma funda e uma pedra pra matar gigante Abraão era valente tinha fé em Deus vencia Josué era valente a batalha não temia Mais o verdadeiro morreu numa cruz e ressuscitou Seu nome é Jesus! O Autor da fé, Pai da Eternidade, Príncipe da paz! Rege as nações! Ele tem poder para curar libertar E te dar a salvação! O Seu sangue purifica o homem do pecado! O enfermo toca em Suas vestes e sai curado! Pra nos dar a salvação morreu numa cruz! O herói é Jesus!  
121;4;Páscoa;141;Páscoa! Páscoa! Páscoa! Páscoa, Páscoa! P, A, S, C, O, A! (4x) “P” de passagem, “A” de amor, “S” de Senhor e Salvador, “C” de Cristo, o caminho para o céu, “O” de orientador, “A” de alegria, amizade e amor! Quando Jesus Cristo a Sua vida entregou, A minha Páscoa bem mais doce se tornou! Morreu na cruz, foi assim que me salvou! Mas no terceiro dia ressuscitou! Páscoa, Páscoa! P, A, S, C, O, A! (2x) “P” de passagem, “A” de amor, ,“S” de Senhor e Salvador, “C” de Cristo, o caminho para o céu, “O” de orientador, “A” de alegria, amizade e amor! Quando Jesus Cristo a Sua vida entregou, A minha Páscoa bem mais doce se tornou! Morreu na cruz, foi assim que me salvou! Mas no terceiro dia ressuscitou! Páscoa, Páscoa! P, A, S, C, O, A! (4x) Páscoa!     
122;4;Quebrantado;142;Eu olho para a cruz e para a cruz eu vou Do Seu sofrer participar, da Sua obra vou cantar! Meu Salvador na cruz mostrou o amor do Pai, o justo Deus! Pela cruz me chamou! Gentilmente me atraiu e eu... Sem palavras, me aproximo quebrantado por Seu amor! Oh, oh, oh, oh... Oh, oh, oh, oh... Oh, oh, oh, oh... Imerecida vida, de graça recebi Por Sua cruz da morte me livrou Trouxe-me a vida, eu estava condenado Mas agora pela cruz eu fui reconciliado! Pela cruz me chamou! Gentilmente me atraiu e eu... Sem palavras, me aproximo quebrantado por Seu amor! [2x] Impressionante é o Seu amor! Me redimiu e me mostrou o quanto é fiel! Pela cruz me chamou! Gentilmente me atraiu e eu... Sem palavras, me aproximo quebrantado por Seu amor! Oh, oh, oh, oh... Oh, oh, oh, oh... Oh, oh, oh, oh... Oh... Oh...     
123;4;Ressuscitou;143;Ressuscitou! Ressuscitou! Ressuscitou! Aleluia! (2x) Ó morte, onde está ó morte, a sua vitória? Jesus Ressuscitou! (2x) Ressuscitou! Ressuscitou! Ressuscitou! Aleluia! (2x) Venceu a morte! Venceu o mal! Venceu as trevas! Jesus ressuscitou! (2x) Ressuscitou! Ressuscitou! Ressuscitou! Aleluia! (2x)         
124;4;Tá na Hora de Louvar;144;A árvore com o vento balança e se sacode Se curva como pode para adorar a Deus! [2x] Erguei as mãos pros céus assim você e eu! E tudo o que tem fôlego vai dando glória a Deus! [2x] Até o passarinho saindo o ovinho Já abre o seu biquinho e vai dando glória a Deus! [2x] Erguei as mãos pros céus assim você e eu! E tudo o que tem fôlego vai dando glória a Deus! [2x] Até dona girafa tão longe aqui do chão Vai dando glória a Deus com aquele gargantão [2x] Erguei as mãos pros céus assim você e eu! E tudo o que tem fôlego vai dando glória a Deus! [2x] Chuê, chuê, chuê Faz o rio a correr Chuá, chuá, chuá Cantando pra Te louvar [2x] Erguei as mãos pros céus assim você e eu! E tudo o que tem fôlego vai dando glória a Deus! [2x]   
125;4;Telefone do Céu;145;O telefone do céu é a oração O telefone do céu é joelho no chão Disque uma vez, disque duas ou três! Se não atender, se não atender disque outra vez!          
126;4;Vamos Sair do Egito;146;Nós vamos sair do Egito! Vamos sair do Egito! Nós vamos sair do Egito, cantando o Senhor é Deus! [2x] Só o Senhor é Deus! Só o Senhor é Deus! Nós vamos sair do Egito, cantando o Senhor é Deus! [2x] Faraó está vindo atrás, mas Deus vai abrir o mar! (2x) Nós vamos sair do Egito! Vamos sair do Egito! Nós vamos sair do Egito, cantando o Senhor é Deus! Miriam tocou o pandeiro, e eu também vou tocar (2x) Nós vamos sair do Egito! Vamos sair do Egito! Nós vamos sair do Egito, cantando o Senhor é Deus! Só o Senhor é Deus! Só o Senhor é Deus! Nós vamos sair do Egito, cantando o Senhor é Deus! [2x] Os velhos e as crianças vão sair do Egito! Os jovens e as crianças vão sair do Egito! A igreja e as crianças, vão sair do Egito! Nós vamos sair do Egito! Vamos sair do Egito! Nós vamos sair do Egito, cantando o Senhor é Deus! Só o Senhor é Deus! Só o Senhor é Deus! Nós vamos sair do Egito, cantando o Senhor é Deus! [2x] Nós vamos sair do Egito! Vamos sair do Egito! Nós vamos sair do Egito, cantando o Senhor é Deus! [2x] Só o Senhor é Deus! Só o Senhor é Deus! Nós vamos sair do Egito, cantando o Senhor é Deus! [2x]
127;5;A Bênção;147;Meninas: Que o Senhor te abençoe E faça brilhar Seu rosto em ti! Que conceda Sua graça e te dê a paz! Amém! Amém! Amém! (2x) Todos: Que o Senhor te abençoe E faça brilhar Seu rosto em ti! Que conceda Sua graça e te dê a paz! Amém! Amém! Amém! (2x) Homens: Que a bênção se derrame até mil gerações! Tua família e teus filhos e os filhos dos teus filhos! Meninas: Que a bênção se derrame até mil gerações! Tua família e teus filhos e os filhos dos teus filhos! Todos: Que a bênção se derrame até mil gerações! Tua família e teus filhos e os filhos dos teus filhos! [2x] Sua presença te acompanhe por detrás e por diante Do teu lado e em ti É contigo! É por ti! Sua presença te acompanhe por detrás e por diante Do teu lado e em ti É contigo! É por ti! E de dia e de noite Tua entrada e saída Em teu riso, Em teu choro É contigo! É por ti! É contigo! É por ti! É contigo! É por ti! É contigo! É por ti! É contigo! É por ti! Amém! Amém! Amém! Amém! Amém! Amém! 
128;5;A Casa é Sua;148;Você é bem-vindo aqui! A casa é Sua, pode entrar! Me esvazio de mim! (2x) Sopra o Teu vento aqui! Toma o Teu trono, vem reinar... Nós queremos Te ouvir! (2x) Essa casa é Sua casa! Nós deixamos ela pra Você, Jesus! [4x] Apareça! Que o Teu nome cresça! Enche este lugar! Enche este lugar! Apareça! Que o Teu nome cresça! Vem me incendiar! Vem me incendiar! [2x] Essa casa é Sua casa! Nós deixamos ela pra Você, Jesus! [4x] Apareça! Que o Teu nome cresça! Enche este lugar! Enche este lugar! Apareça! Que o Teu nome cresça! Vem me incendiar! Vem me incendiar! [2x] Essa casa é Sua casa! Nós deixamos ela pra Você, Jesus! [4x] 
129;5;Adorador por Excelência;149;Quero dar o melhor de mim! Quero oferecer sacrifício de louvor! Quero ser bem mais do que já sou, Um adorador por excelência me tornar! Eu não vou me importar com o que vai acontecer Eu só quero Te exaltar! Tu És a razão do meu viver! Eu não posso me calar! Tenho adoração em meu DNA! Um adorador por excelência... Um adorador por excelência... Um adorador por excelência... Quero ser! Quero dar o melhor de mim! Quero oferecer sacrifício de louvor! Quero ser bem mais do que já sou, Um adorador por excelência me tornar! Eu não vou me importar com o que vai acontecer Eu só quero Te exaltar! Tu És a razão do meu viver! Eu não posso me calar! Tenho adoração em meu DNA! Um adorador por excelência... Um adorador por excelência... Um adorador por excelência... Quero ser! Um adorador por excelência... Um adorador por excelência... Um adorador por excelência... Quero ser!  
130;5;Ainda que a Figueira;150;Tu és a minha porção Tu és a minha herança Tu és o meu socorro Nos dias de tribulação! Mesmo que meus pais me deixem, Mesmo que amigos me traiam... Eu sei que em Seus braços eu encontro Salvação! Ainda que a figueira não floresça, Ainda que a videira não dê o seu fruto... Mesmo que não haja alimento nos campos eu me alegrarei em Ti! Ainda que a figueira não floresça, Ainda que a videira não dê o seu fruto... Mesmo que não haja alimento nos campos eu me alegrarei em Ti! Tu és a minha porção Tu és a minha herança Tu és o meu socorro Nos dias de tribulação! Mesmo que meus pais me deixem, Mesmo que amigos me traiam... Eu sei que em Seus braços eu encontro Salvação! Ainda que a figueira não floresça, Ainda que a videira não dê o seu fruto... Mesmo que não haja alimento nos campos eu me alegrarei em Ti! Ainda que a figueira não floresça, Ainda que a videira não dê o seu fruto... Mesmo que não haja alimento nos campos eu me alegrarei em Ti!  
131;5;Além do Rio Azul;151;Além do rio azul As ruas são de ouro e de cristais Ali tudo é vida! Ali tudo é paz! Morte e choro... Nunca mais! Tristeza e dor... Nunca mais! Verei o grande rio da vida Claro como o cristal Verei a face do meu Mestre querido! Não haverá mais noite ali! Não haverá nenhum clamor! Verei os olhos de Jesus E tocarei Seu corpo enfim! [2x] As nações andarão na Sua luz E as portas jamais se fecharão! A cidade é de ouro puro! De jaspe é seu muro! Além do rio azul! Morte e choro, tristeza e dor... Nunca mais! Nunca mais! [4x] Não haverá mais noite ali! Não haverá nenhum clamor! Verei os olhos de Jesus E tocarei Seu corpo enfim! Não haverá mais noite ali! Não haverá nenhum clamor! Verei os olhos de Jesus E tocarei Seu corpo enfim! 
132;5;Alfa e Ômega;152;Não há outro como Tu... Soberano e Fiel! Não há outro como Tu! Reina sobre a terra e céus! És o Alfa e Ômega, Início e Fim! És o ar que eu respiro, tudo pra mim! Tu És Jesus! Tu És Jesus! És o Alfa e Ômega, Início e Fim! És o ar que eu respiro, tudo pra mim! Tu És Jesus! Tu És Jesus! Alfa e Ômega, Início e Fim! Tudo pra mim... Tudo pra mim... [4x] És o Alfa e Ômega, Início e Fim! És o ar que eu respiro Tudo pra mim! Tu És Jesus! Tu És Jesus! És o Alfa e Ômega, Início e Fim! És o ar que eu respiro Tudo pra mim! Tu És Jesus! Tu És Jesus! És o Alfa e Ômega, Início e Fim! És o ar que eu respiro Tudo pra mim! Tu És Jesus! Tu És Jesus! És o Alfa e Ômega, Início e Fim! És o ar que eu respiro Tudo pra mim! Tu És Jesus! Tu És Jesus! Tu És Jesus! Tu És Jesus! 
133;5;Algo Novo;153;Vem me visitar hoje aqui Quero conhecer mais de Ti! Espírito vem... Espírito vem... Espírito Santo! (2x) Eu quero viver algo novo! Faz meu coração arder de novo! Fazendo todo medo desaparecer Trazendo sobre mim um novo amanhecer Eu quero viver algo novo! Vem me visitar hoje aqui Quero conhecer mais de Ti! Espírito vem... Espírito vem... Espírito Santo! (4x) Eu quero viver algo novo! Faz meu coração arder de novo! Fazendo todo medo desaparecer Trazendo sobre mim um novo amanhecer Eu quero viver algo novo! Eu quero viver algo novo! Faz meu coração arder de novo! Fazendo todo medo desaparecer Trazendo sobre mim um novo amanhecer Eu quero viver algo novo! Santo Espírito desce como fogo! Santo Espírito desce como fogo! Incendeia! Incendeia! 
134;5;Aquele que está Feliz;154;Aquele que está feliz diga amém: Amém! Aquele que está feliz grite aleluia: Aleluia! Aquele que está feliz bata palma assim... Aquele que está feliz cante comigo assim, Oh... Oh... Oh! Com Jesus no coração a gente é feliz, é feliz... Com Jesus na condução tudo é muito bom! Jesus é alegria, euforia, companhia todo dia! Jesus é o Motivo da nossa alegria! [2x] Aquele que está feliz diga amém: Amém! Aquele que está feliz grite aleluia: Aleluia! Aquele que está feliz bata palma assim... Aquele que está feliz cante comigo assim, Oh... Oh... Oh! Com Jesus no coração a gente é feliz, é feliz... Com Jesus na condução tudo é muito bom! Jesus é alegria, euforia, companhia todo dia! Jesus é o Motivo da nossa alegria! [2x]    
135;5;Atos 2;155;Nós estamos aqui tão sedentos de Ti Vem ó Deus! Vem ó Deus! Enche este lugar, meu desejo é sentir Teu poder! Teu poder! [2x] Então vem me incendiar, Meu coração é o Teu altar! Quero ouvir o som do céu, Tua glória contemplar! [2x] Nós estamos aqui tão sedentos de Ti Vem ó Deus! Vem ó Deus! Enche este lugar, meu desejo é sentir Teu poder! Teu poder! Então vem me incendiar, Meu coração é o Teu altar! Quero ouvir o som do céu, Tua glória contemplar! [2x] Te damos honra! Te damos glória! Teu é o poder pra sempre amém... [3x] Então vem me incendiar, Meu coração é o Teu altar! Quero ouvir o som do céu, Tua glória contemplar! [2x] 
136;5;Caminho no deserto;156;Estás aqui movendo entre nós! Te adorarei... Te adorarei... Estás aqui mudando destinos! Te adorarei... Te adorarei... Estás aqui operando milagres! Te adorarei... Te adorarei... Estás aqui transformando nossas vidas! Te adorarei... Te adorarei... Meu Deus é... Deus de milagres, Deus de promessas, Caminho no deserto, Luz na escuridão! Meu Deus... Esse é quem Tu És! [2x] Estás aqui tocando os corações! Te adorarei... Te adorarei... Estás aqui curando multidões! Te adorarei... Te adorarei... Estás aqui restaurando os corações! Te adorarei... Te adorarei... Estás aqui transformando histórias! Te adorarei... Te adorarei... Meu Deus é... Deus de milagres, Deus de promessas, Caminho no deserto, Luz na escuridão! Meu Deus... Esse é quem Tu És! [2x] Enxuga as lágrimas, Restaura os corações! Tu És a Resposta, Jesus! [2x] Meu Deus é... Deus de milagres, Deus de promessas, Caminho no deserto, Luz na escuridão! Meu Deus... Esse é quem Tu És! [6x]  
137;5;Canta Minh’alma;157;Veja o amor do Pai, Mistério que não posso entender! Quão grande é o Teu amor E o quanto nos deseja! As coisas deste mundo Não são nada diante d’Ele... Pai infalível! O que se compara a Ti? Veja o Filho de Deus, O Leão e o Cordeiro dado a nós! O Verbo Se encarnou! Salvador da minha alma! Sofreu por tanto amar a humanidade, No Seu sangue há salvação! Jesus, Messias! O Justo Se entregou Não foi o fim, Ele ressuscitou! Canta minh’alma! Canta minh’alma! Que amor tão grande! (2x) [2x] Que grande amor... Veja comigo está O Espírito queimando em meu ser! Amigo e Protetor Que me leva à verdade! Traz luz pro meu perdido coração Até meu tempo aqui findar! Ó Santo Espírito Teu reino eu quero ver! Ó Santo Espírito Faz em mim o Teu querer! Canta minh’alma! Canta minh’alma! Que amor tão grande! (2x) [2x] Que grande amor... 
138;5;Confiarei;158;Se o mundo tenta me parar Eu não vou desanimar, Eu confiarei em Ti! E se no deserto eu passar, Eu não vou desanimar, Eu confiarei em Ti! Minha fé está firmada no meu Salvador! Meu castelo forte Ele É! É meu refúgio e segurança n’Ele firme estou! No Senhor não vou me abalar! Confiarei em Ti! Se o Senhor é por mim, quem será contra mim? Confiarei em Ti! Se o Senhor é por mim, quem será contra mim? Confiarei! Não temerei! Oh, oh, oh... ei, ei, ei, ei... (4x) Confiarei em Ti! Se o Senhor é por mim, quem será contra mim? Confiarei em Ti! Se o Senhor é por mim, quem será contra mim? Confiarei! Não temerei!   
139;5;Coração Igual ao Teu;159;Se Tu olhares Senhor pra dentro de mim... Nada encontrarás de bom! Mas um desejo eu tenho de ser transformado! Preciso tanto do Teu perdão! Dá-me um novo coração! Dá-me um coração igual ao Teu, meu Mestre! Dá-me um coração igual ao Teu... Coração disposto a obedecer! Cumprir todo o Teu querer! Dá-me um coração igual ao Teu... Ensina-me amar o meu irmão! A olhar com Teus olhos, perdoar com Teu perdão! Enche-me com Teu Espírito, Endireita os meus caminhos Ó Deus dá-me um novo coração! [2x] Dá-me um coração igual ao Teu, meu Mestre! Dá-me um coração igual ao Teu... Coração disposto a obedecer! Cumprir todo o Teu querer! Dá-me um coração igual ao Teu... (2x) Coração disposto a obedecer! Cumprir todo o Teu querer! Dá-me um coração igual... ao Teu!  
140;5;Corpo e Família;160;Recebi um novo coração do Pai... Coração regenerado, Coração transformado, Coração que é inspirado por Jesus! Como fruto desse novo coração... Eu declaro a paz de Cristo! Te abençoo meu irmão! Preciosa é a nossa comunhão! Somos corpo, e assim bem ajustado Totalmente ligado, unido, vivendo em amor! Uma família sem qualquer falsidade! Vivendo a verdade Expressando a glória do Senhor! Uma família vivendo o compromisso Do grande amor de Cristo! Eu preciso de ti, querido irmão... Precioso és para mim, querido irmão! Eu preciso de ti, querido irmão... Precioso és para mim, querido irmão!   
141;5;Creio que Tu És a Cura;161;Me escutas quando clamo E acalma o meu pensar, Me levas pelo fogo Curando todo meu ser Confio em Ti... (2x) Creio que Tu És a cura! Creio que És tudo para mim... Creio que Tu És a vida! Creio que não há outro igual a Ti! Jesus eu preciso de Ti! Me escutas quando clamo E acalma o meu pensar, Me levas pelo fogo Curando todo meu ser Confio em Ti... (2x) Creio que Tu És a cura! Creio que És tudo para mim... Creio que Tu És a vida! Creio que não há outro igual a Ti! Jesus eu preciso de Ti! Não há outro igual a Ti! Nada é impossível para Ti, Nada é impossível... Nada é impossível para Ti, Tens o meu mundo em Tuas mãos! [2x] Creio que Tu És a cura! Creio que És tudo para mim... Creio que Tu És a vida! Creio que não há outro igual a Ti! Jesus eu preciso de Ti... Não há outro igual a Ti... Jesus eu preciso de Ti! 
142;5;Cruz;162;Podia ter rejeitado, Mas não rejeitou! Então assim foi levado Ao lugar de muita dor! Crucificaram! Pregaram Suas mãos Chicotearam! Sangue caia no chão Mas Ele não Reclamou! (2x) Ele só perguntou, Em alta voz gritou: Eli, Eli, Lamá Sabactâni! Deus meu, Deus meu, Por que Desamparastes Teu Filho? [2x] E eis que o véu se rasgou! A terra tremeu! Algo acontecia Entre a terra e o céu! O véu se rasgou! E o povo assim falou: Verdadeiramente este era o Filho de Deus! Oh, oh, oh, oh! Verdadeiramente este era o Filho de Deus!    
143;5;Decreto de Vitória;163;A ansiedade do futuro Me consome todo dia Quem será ou o que será Do amanhã da minha vida? A noite passa, o dia chega E o sono nunca vem Pois o medo é maior Que a esperança do além! O que fazer? Resta somente uma saída Uma solução pra minha vida Correr a Ele, lançar n’Ele Toda minha ansiedade Pois o poder que emana n’Ele É tão grandioso e veraz E o que Ele pode nessa terra Não há um que seja capaz! Vou clamar.... Meu Mestre e Senhor, não me despeças daqui! Sem Teu toque hoje eu sentir Te imploro, não me deixe ir... Pois se eu Te tocar tudo vai se transformar! E o medo do futuro que aflige tanto o meu coração sairá! Quando eu Te tocar...! [2x] Hoje é o dia que o Mestre vou tocar! Sobre Jesus minha ansiedade vou lançar! Hoje é o dia que o Mestre vou tocar! Sobre Jesus minha ansiedade vou lançar! Hoje eu Te toquei! A minh’alma aliviei! E ao voltar pra minha casa A vitória certamente levarei! Pois vim ante o altar minha bênção receber! E esta semana um decreto de vitória eu terei! [2x] Hoje eu Te toquei! A minh’alma aliviei! E ao voltar pra minha casa A vitória certamente levarei! Pois vim ante o altar minha bênção receber! E esta semana um decreto de vitória... (4x) Eu terei! 
144;5;Deixa Eu te Usar;164;Apesar das feridas, Apesar das decepções Eu te chamei... (2x) Apesar do passado, Apesar das desilusões Eu te chamei... (2x) Deixa Eu te usar para curar! Deixa Eu te usar para salvar! Enquanto Eu te uso Eu cuido de tudo Que te faz chorar! [2x] Eu não te dei espírito de temor, mas de ousadia! Onde Eu te mandar tu irás, Onde Eu te colocar, tu brilharás! E Eu te encherei (3x) Vai, vai, vai em paz! Deixa Eu te usar para curar! Deixa Eu te usar para salvar! Enquanto Eu te uso Eu cuido de tudo Que te faz chorar! [2x]    
