Nº;Pasta;Título;Página;Letra
257;6;Eu Vou Viver Milagres;282;Solo: Alguém falando ao meu ouvido que aquela promessa Tinha prazo de validade e já passou do tempo Palavras que parecem flecha para nos ferir... Tirar a nossa paz e perturbar os pensamentos! Mas Aquele que fez a promessa tem Seu próprio tempo! Aliás, Ele manda no tempo e faz como Ele quer! Ele já falou pra mim que eu viverei milagres! Sua palavra é o suficiente para aumentar minha fé! Ah, e quando Ele fala comigo me sinto mais forte! Sua presença me renova, me dá forças pra seguir! E por mais que alguém tente com palavras tirar meu sorriso... Deus sempre me dará motivos pra sorrir! Todas: Eu vou viver milagres! O Deus que eu sirvo é Deus de milagres! Eu sei que está chegando novidades! Pois Quem fez a promessa é fiel, É fiel pra cumprir [2x] E eu não vou desistir! Solo: Ah, e quando Ele fala comigo me sinto mais forte! Sua presença me renova, me dá forças pra seguir! E por mais que alguém tente com palavras tirar meu sorriso... Deus sempre me dará motivos pra sorrir! Todas: Eu vou viver milagres! O Deus que eu sirvo é Deus de milagres! Eu sei que está chegando novidades! Pois Quem fez a promessa é fiel, É fiel pra cumprir [2x] E eu não vou desistir! Eu vou viver milagres! O Deus que eu sirvo é Deus de milagres! Eu sei que está chegando novidades! Pois Quem fez a promessa é fiel, É fiel pra cumprir E eu não vou desistir! Solo: Alguém falando ao meu ouvido que aquela promessa... 
258;6;Fiel Adorador;283;Presos em cadeias por amor a Jesus, São decapitados por amor a Jesus Mas não negam sua fé, A identidade é povo adorador! Muitos estão em prisões E os mártires já são milhões! Mas não negam sua fé, A identidade é povo adorador! Povo adorador mesmo perseguido, Povo adorador segue destemido Mas não nega a fé! Povo adorador se preciso for dá seu sangue em guerra, Povo adorador não para, não recua, nunca se entrega! Pelo mundo a fora são mais de milhões! E até mesmo dentro de prisões seu coração tá livre para adorar! Prisão não cala fiel adorador! Perseguição não cala fiel adorador! Podem odiar, perseguir e matar, mas nem a morte cala fiel adorador! [2x] Livre eu estou para adorar! Livre tu estás para adorar! Podem odiar, perseguir e matar, mas nem a morte cala fiel adorador! [2x] Muitos estão em prisões E os mártires já são milhões! Mas não negam sua fé, A identidade é povo adorador! Povo adorador mesmo perseguido, Povo adorador segue destemido Mas não nega a fé! Povo adorador se preciso for dá seu sangue em guerra, Povo adorador não para, não recua, nunca se entrega! Pelo mundo a fora são mais de milhões! E até mesmo dentro de prisões seu coração tá livre para adorar! Prisão não cala fiel adorador! Perseguição não cala fiel adorador! Podem odiar, perseguir e matar, mas nem a morte cala fiel adorador! [2x] Levarei eu também minha cruz ‘té por uma coroa trocar! Livre eu estou para adorar! Livre tu estás para adorar! Podem odiar, perseguir e matar, mas nem a morte cala fiel adorador! [2x] Fiel adorador! 
259;6;Filho do Rei;284;Solo: É mesmo assim, Não há vitória sem luta É mesmo assim, Pra chegar até o fim você tem que insistir! Não é fácil exibir Um sorriso em meios às provas Que persiste dia-a-dia te causando agonia, Machucando o teu coração... Todas: Mas há uma palavra como profecia que diz que o justo não pode viver na contramão! Há uma saída! Hoje Cristo está mudando esta situação! Eu profetizo sobre tua vida uma nova direção Filho do Rei não pode ser plebeu, não pode mendigar o pão Eu profetizo que a partir de hoje tudo vai ser diferente Você vai ver o quanto vale a pena ser fiel e persistente! Eu profetizo cura! Eu profetizo benção! Sobre tua casa uma nova estação! Eu profetizo, eu profetizo sobre você! Mas há uma palavra como profecia que diz que o justo não pode viver na contramão! Há uma saída! Hoje Cristo está mudando esta situação! Eu profetizo sobre tua vida uma nova direção Filho do Rei não pode ser plebeu, não pode mendigar o pão Eu profetizo que a partir de hoje tudo vai ser diferente Você vai ver o quanto vale a pena ser fiel e persistente! Eu profetizo cura! Eu profetizo benção! Sobre tua casa uma nova estação! Eu profetizo, eu profetizo sobre você!     
260;6;Gideão e os Trezentos;285;Solo: Junta o povo Gideão, Chegou a hora de lutar! Grande vai ser a escolha, os covardes e medrosos do caminho irão voltar! Junta o povo, Gideão, Eu vou marcar a tua história Te darei o livramento, Pois somente com trezentos Eu te darei vitória! Trinta e dois mil era a quantidade de homens a postos para pelejar Aparentemente todos corajosos, preparados pra lutar Porém há momentos que Deus resolve agir diferente E o Senhor disse a Gideão: “Ainda tem muita gente” E Disse o Senhor a Gideão: Muito é o povo que está contigo para Eu dar os midianitas em tuas mãos, a fim de que Israel não se glorie contra mim dizendo: A minha mão me livrou... Apregoa pois agora aos ouvidos de todo o povo dizendo: Os covardes e medrosos voltem! Todas: Então o povo ouviu e começou a voltar: um, dois, voltaram vinte mil! Porém há momentos que Deus quer agir diferente E o Senhor disse a Gideão: “Ainda tem muita gente” Solo: E disse o Senhor a Gideão: Faz descer o povo às águas e ali os provarei E há de ser que aquele que Eu te disser “esse irá contigo”, esse contigo irá! Porém todo aquele que Eu disser “esse não irá contigo”, esse não irá! Todas: E Gideão ordenou descer às águas e de longe começou entender Que havia um segredo de Deus na forma que o povo água ia beber Pois quem tomasse a água com a mão e levasse a boca este serviria! Porém quem baixasse perdendo atenção esse voltaria! E o segredo de Jeová, naquele momento Era escolher entre os trinta e dois mil somente trezentos Mas trezentos com buzinas! Trezentos com cântaros! Trezentos com tochas! Trezentos com fogo! Trezentos que obedecem! Trezentos corajosos! Trezentos verdadeiro! Trezentos valorosos! Porque Deus quando entra na guerra é d’Ele o comando, é d’Ele a estratégia! Manda quebrar o cântaro e toca as buzinas Não tente entender o trabalhar de Deus! E o resultado é [vitória (9x)] Deus está dando o livramento! E o resultado é [vitória (7x)] Se trinta e dois mil não querem ir Deus usa os trezentos! Mas trezentos com buzinas! Trezentos com cântaros! Trezentos com tochas! Trezentos com fogo! Trezentos que obedecem! Trezentos corajosos! Trezentos verdadeiro! Trezentos valorosos! Se trinta e dois mil não querem ir Deus usa os trezentos Aleluia! A vitória é do povo de Deus!       
261;6;Há uma Saída;287;Bem distante eu te vi parado a beira do caminho Cabisbaixo e sem direção se sentindo tão sozinho Coração batendo angustiado em seu peito Você vive maus momentos! É todo dia a mesma coisa e você se cansou de tanto sofrimento Mas eu declaro que chegou a hora e Deus vai tirar você desse vento! Se a fúria do inimigo contra ti se levantar Ele ordena anjos poderosos para te guardar Foi ungido, foi remido e separado pra vencer e reinar com Ele! Deus vai na frente garantindo a vitória para os filhos Seus! Quebrando as correntes sujeitando os inimigos porque Ele é Deus! Faz sair água da rocha, com esse Deus não há quem possa! Não há como nosso Deus! Lá no Egito trouxe as pragas e humilhou um tal de Faraó Exaltou a Israel e fez saber que aquele povo não estava só Faz a morte virar vida! Pra tudo tem uma saída! Não há Deus como esse Deus! Elohim, El Shaddai, Adonai, Adore o nome d’Ele! Ele é Deus verdadeiro, Ele te amou primeiro, te levanta desse chão! Elohim, El Shaddai, Adonai, Adore o nome d’Ele! Faz a morte virar vida, pra tudo tem uma saída, faz de ti um campeão!    
262;6;Hino da Vitória;288;Solo: Quem é o Homem que teve o poder de andar sobre o mar? Quem é Ele que pode fazer o mar se calar? No momento em que a tempestade vier te afogar... Ele vem com toda autoridade e manda acalmar! Quem é o Homem que teve o poder de fazer Israel Caminhar por entre as águas do Mar Vermelho? Fez caminho no meio do mar para o povo de Israel passar! D’outro lado com os pés enxutos puderam cantar o Hino da Vitória! Todas: Quando estiver frente ao mar e não puder atravessar... Chame este Homem com fé, Só Ele abre o mar! Não tenha medo irmão se atrás vem Faraó Deus vai te atravessar e você vai entoar o Hino da Vitória! Toda vez que o Mar Vermelho tiver que passar Chame logo este Homem para te ajudar! É nas horas mais difíceis que Ele mais te vê, Pode chamar esse Homem que Ele tem poder! Se passares pelo fogo não vai te queimar Se nas águas tu passares não vão te afogar! Faça como Israel que o mar atravessou E no nome do Senhor o Hino de Vitória do outro lado cantou! Do outro lado cantou... Do outro lado cantou!   
263;6;Homem dos Milagres;289;Eu queria estar lá no meio da multidão Contemplar aquela mulher que usou a sua fé, tocando em Jesus Eu queria estar lá no momento da ressurreição Quando Jesus chamou a Lázaro Saia para fora e Lázaro saiu... Saiu com vida! Eu queria estar lá, ver o cego Bartimeu Clamando: Filho de Davi tem misericórdia de mim! Jesus parou, lhe perguntou: O que queres que eu te faça? Senhor, que eu veja! E ele viu... foi lindo! Mas a cena mais bonita foi a de João Batista quando foi Jesus batizar O céu se abriu e o Espírito desceu Uma voz ecoou: Este é meu filho, O amado meu! Não pude estar lá, mas Ele está aqui! A Sua unção já posso sentir! E hoje um milagre Deus vai fazer aqui! O Homem dos milagres está neste lugar! Toda enfermidade hoje não vai suportar O toque da Sua mão cheia de unção! Receba tua benção, tua cura, tua libertação! Já posso ver o mal indo embora! Já posso ver a tua vitória! Levante as mãos, comece a louvar! O Homem dos milagres está neste lugar! Está neste lugar! Está neste lugar!  
264;6;Jairo;290;Solo: O que fazer quando a ciência e a medicina desenganam? O desespero bate a porta e você reclama Angustiado, você não sabe mais o que dizer... O que fazer quando o dinheiro ou posição não podem ajudar Tua fama, tua glória não vão adiantar quando a morte no teu lar tiver que entrar! Jairo se sentiu assim tão fraco e indefeso! Vendo sua filha quase morta saiu a procurar uma resposta e pensou consigo mesmo, Vou deixar o eu, a posição, vou correr atrás da multidão Ali está alguém que pode me ajudar! Jairo partiu determinado! Na sua bagagem a certeza, maior que o desespero, a sua fé! No coração a esperança, uma grande fé e confiança Se jogou aos pés de Jesus de Nazaré! E O adorou, e suplicou: Socorre-me Senhor! Jesus movido de uma grande compaixão disse: Jairo se levante desse chão! Creia Eu sou a ressurreição! E o milagre Ele realizou! Pro milagre acontecer você tem que clamar! Pro milagre acontecer você tem que ter fé! Pro milagre acontecer você tem que insistir Cair aos teus pés e O adorar! Ele vai além da morte! Ele vai além da vida! Ele vai além da dor! Ele vai além do que a mente humana imaginou! Ele tem autoridade! Ele em todo poder! Meu irmão se você crer Ele transforma o impossível em Realidade pra você! [2x] Ele transforma em Realidade pra você! Ele transforma em Realidade pra você! Solo: O que fazer quando a ciência e a medicina desenganam... 
265;6;Mais um Milagre;291;Solo: Tem mais um milagre no caminho, Dessa vez um grande oficial do rei O procurou Jesus chegava no lugar que um dia fez da água vinho Desesperado, aquele oficial n’Ele encostou, Tem mais um milagre no caminho, Por favor Senhor, desça lá em casa, vem me socorrer! O meu filho que eu tenho cuidado com muito carinho, Agora está num leito ressequido prestes a morrer! Todas: Nessa hora o coração do homem foi examinado O estado de angústia foi detectado! Por que só Ele vê o coração chorar... Pelos olhos da misericórdia ele foi alcançado Jesus deu a resposta com o resultado: Seu filho está curado, pode retornar! Existe um milagre no caminho ainda, existe uma resposta que vem de Jesus! O estado de miséria a qualquer hora finda e nessa escuridão vai acender a luz! A misericórdia já te alcançou, você não está sozinho! Nosso Mestre não mudou, tem mais um milagre no caminho! Seu milagre está a caminho! (3x) Tem mais um milagre no caminho! [2x] Existe um milagre no caminho ainda, existe uma resposta que vem de Jesus! O estado de miséria a qualquer hora finda e nessa escuridão vai acender a luz! A misericórdia já te alcançou, você não está sozinho! Nosso Mestre não mudou, tem mais um milagre no caminho! Tem mais um milagre no caminho, É pra você... Seu milagre está a caminho!  
266;6;Medley 1 - UFADECAP - Festa Dep. 2020;292;Solo: Ele vem, brilhando como o sol! Voando sobre as nuvens! A trombeta eu posso ouvir! E um grande coral cantando uma canção dizendo que já vem a salvação! Estes são os dias de Elias, pregando a palavra de Deus E estes são os dias de Moisés, justiça reinando outra vez! E estes são os dias de hoje, o mundo vive em escravidão! Mas nós somos os pregadores anunciando a volta do Rei! Acorda, igreja, Deus me mandou te avisar! Acorda, igreja, a coisa vai apertar! Acorda, aí vem o Esposo! Acorda, igreja, é tempo de juntar os pés! Acorda, igreja, o céu espera os fiéis! Acorda, Jesus vem de novo! Ele vem, brilhando como o sol! Voando sobre as nuvens! A trombeta eu posso ouvir! E um grande coral cantando uma canção dizendo que já vem a salvação! (2x) No coral eu quero cantar, declarar que Ele é Santo, Santo! Infinitamente adorar dizendo que Jesus é Santo, Santo! A composição do céu vai cantar quem for fiel! O hino da vitória será o meu troféu! No coral eu quero cantar, declarar que Ele é Santo, Santo! Infinitamente adorar dizendo que Jesus é Santo, Santo! A composição do céu vai cantar quem for fiel! Vou erguer o meu troféu!  
267;6;Medley 2 - UFADECAP - Festa Dep. 2020;293;Solo: Se você já pensou em desistir tenha fé e não pare de sorrir! Você vai ver que o inimigo não vai entender que o crente até mesmo chorando ele canta porque... Se chorar, chora nos pés do Senhor! Tem Jesus como seu Consolador! Teu sofrer, uma noite até pode durar, mas o crente sabe que a vitória vem pela manhã Então cante assim... Quando estiver frente ao mar e não puder atravessar Chame este Homem com fé, só Ele abre o mar! Não tenha medo irmão se atrás vem Faraó Deus vai te atravessar e você vai entoar o Hino da Vitória! O crente cheio da unção manda glória pra cima e recebe poder Ele passa o Mar Vermelho, sai do lado de lá! Ele expulsa os demônios, faz o inferno tremer! Ele louva a Deus na cova, faz leão dormir Ele ora no holocausto e o fogo vai cair! Quando está no deserto Deus envia o maná Se vier o Jordão o rio vai abrir E se não abrir vai passar por cima das águas na unção de Deus! Lembra da nuvem de dia? Fui Eu! Lembra da coluna de fogo? Fui Eu! Eu fiz pedra jorrar água pra você beber! Lembra do maná do céu? Fui Eu! Lembra do caminho no meio do mar? Canta, pois Sou Eu Quem cuido de você! Ninguém vai te tocar! Ninguém vai te deter! E se te acusar, Eu defendo você! Eu te abençoo aqui, Eu te abençoo lá! Onde pisar teu pé abençoado será! Eu dou, Eu tomo, exalto, humilho, abato e honro, dou e tiro Tenho, faço, mando, posso, Eu Sou, Eu Sou! Eu posso matar! Eu faço viver! Eu posso exaltar! Eu posso abater! E se Eu quero te abençoar quem vai contender? Sem Te adorar sou como grão de areia no fundo do mar Sou como folha seca voando no ar, como pássaro sem asa, sem poder voar... Sem te adorar minha vida não é vida, não tenho alegria! Sou alguém sem esperança em busca de guarida, Uma alma implorando por socorro! E é por isso que se eu não Lhe adorar (3x) eu morro...      
268;6;Menina dos Olhos de Deus;295;Pra que ficar assim, deixar se intimidar?  Enfrente o que há de vir com fé sem vacilar Se fraco te mostrares o medo vai vencer, A força do cristão está na sua fé! Deus faz o impossível! É só acreditar! Põe sua fé em Deus e ninguém te vencerá! Se vier a tempestade Deu faz acalmar! Se há muro na tua frente Deus vai derrubar! Se o inferno se levanta não te atingirá! Seu escudo protetor Se chama Jeová! Teu futuro e tua história quem escreve é Deus! Ele faz a trajetória dos caminhos teus! Se na frente tem gigante Deus joga no chão! Da vitória de um crente Deus não abre mão! E ai de quem tocar em um só cabelo seu, você é a menina dos olhos de Deus! (2x) Você não está só, não vive por viver Existe um Deus no céu cuidando de você! Se o tempo impõe limites a fé te leva além! Põe sua fé em Deus e não temerás ninguém! Se vier a tempestade Deu faz acalmar! Se há muro na tua frente Deus vai derrubar! Se o inferno se levanta não te atingirá! Seu escudo protetor Se chama Jeová! Teu futuro e tua história quem escreve é Deus! Ele faz a trajetória dos caminhos teus! Se na frente tem gigante Deus joga no chão! Da vitória de um crente Deus não abre mão! E ai de quem tocar em um só cabelo seu, você é a menina dos olhos de Deus! (2x) 
269;6;Milagres e Maravilhas;296;Milagres! Milagres! Milagres vão acontecer! Milagres! Milagres! Milagres Deus vai fazer! No passado Jesus operou muitas maravilhas Onde Ele passava milagres aconteciam! Ordenava e o mal ia embora! Não marcava nem dia, nem hora A missão dEle aqui na terra era fazer o bem! Curou lepra, deu vista ao cego, fez coxo andar! Fez o surdo ouvir, também fez o mudo falar! Expulsava todos os demônios, também fez morto ressuscitar! Meu Jesus não mudou e hoje pode operar aqui! Eu quero ver grandes milagres acontecerem! O mudo falar, o surdo ouvir e o cego ver! O paralítico sair correndo para provar que Tu és tremendo! Deus poderoso! Ninguém impede quando queres agir! Tu podes curar qualquer doença e mandar embora a depressão, A tuberculose, a AIDS, problemas de coração E se alguém morrer, Tu és a vida e faz reviver pelo Seu poder! Cura o câncer da alma do homem e faz renascer! [2x] E se alguém morrer, Tu és a vida e faz reviver pelo Seu poder! Cura o câncer da alma do homem e faz renascer!   
270;6;Milhões de Vozes;297;Todas: Hosana! Hosana! Hosana àquele que venceu! Hosana! Hosana! Hosana ao Filho de Deus! Solo: O mundo está querendo me desanimar, Falando que Jesus, não mais vai voltar... Já passou-se muito tempo e nada aconteceu... Mas aguardo a promessa, que nos fez o filho de Deus Todas: Em que o céu irá se abrir e a glória vai surgir! E a igreja vestida de branco, para o céu ira subir! Seu nome é Santo, Santo, Santo: Vou cantar assim! A coroa está na mão daquele que venceu! Pois o Seu nome É tremendo! Poderoso Deus! Os vinte e quatro anciões cantam glória sem parar! Canta anjo, canta arcanjo, canta querubim! Milhões de vozes diante dEle, cantam serafins! E a igreja reunida, revestida, bem servida vai cantar assim: Hosana! Hosana! Hosana àquele que venceu! Hosana! Hosana! Hosana ao Filho de Deus! Vou exaltar, vou adorar, vou bendizer, vou proclamar Este é o Cordeiro que morreu pra me salvar! Hosana! Hosana! Hosana ao Filho de Deus! Hosana! Hosana! Hosana! Hosana àquele que venceu! Hosana! Hosana! Hosana ao Filho de Deus! Ao Filho de Deus!  
271;6;Na Unção de Deus;298;Solo: Quando as lutas vierem contra ti, Irmão insista, ainda não é o fim! A tua fé, mesmo fraca... Ela é forte! Destrói muralhas! Ponha os olhos no Senhor Jesus... Receba a benção e a Sua luz! Você vai ver... Você vai vencer! Na unção de Deus e no Seu poder! Todas: O crente cheio da unção manda glória pra cima e recebe poder Ele passa o Mar Vermelho, sai do lado de lá! Ele expulsa os demônios, faz o inferno tremer! Ele louva a Deus na cova, faz leão dormir Ele ora no holocausto e o fogo vai cair! Quando está no deserto Deus envia o maná Se vier o Jordão o rio vai abrir... E se não abrir vai passar por cima das águas na unção de Deus! O crente cheio da unção manda glória pra cima e recebe poder Ele passa o Mar Vermelho, sai do lado de lá! Ele expulsa os demônios, faz o inferno tremer! Ele louva a Deus na cova, faz leão dormir Ele ora no holocausto e o fogo vai cair! Quando está no deserto Deus envia o maná Se vier o Jordão o rio vai abrir... E se não abrir vai passar por cima das águas na unção de Deus! Na unção de Deus!  
272;6;Não Será assim;299;Minh’alma suspira por meu Deus... Minha esperança, ela vem do céu! Por isso não, não temo a nada os perigos em minha jornada Pois tenho um Deus que está comigo pra me ajudar! Vai me ajudar! Vai me ajudar! Eu tenho um Deus que vai me ajudar! O inimigo quer ver o meu fim, mas se engana, não será assim! Porque as misericórdias de Deus, elas são sobre mim! Há momentos nesta vida que as aflições são fortes demais E parece que não vou suportar! Mas, quando isso acontece, sinto minhas forças se acabar Jesus aparece e me diz: Vou te ajudar! Vai me ajudar! Vai me ajudar! Eu tenho um Deus que vai me ajudar! O inimigo quer ver o meu fim, mas se engana, não será assim! Porque as misericórdias de Deus, elas são sobre mim! Jesus está perto de voltar para com Ele me levar Sabendo disto, o inimigo quer me atrapalhar! Não adianta ele lutar, porque Jesus está a me ajudar E com Sua ajuda, certamente, eu chegarei lá! Vai me ajudar! Vai me ajudar! Eu tenho um Deus que vai me ajudar! O inimigo quer ver o meu fim, mas se engana, não será assim! Porque as misericórdias de Deus, elas são sobre mim!    
273;6;No Limite;300;Quando as portas se fecham e a gente não vê saída e direção, É nos momentos mais precisos que a gente não tem um amigo pra estender a mão Quando a gente chega no nosso limite E a força em nós já não existe e só nos resta o chão Quando a esperança cansa e vai embora, Jesus diz chegou a hora é minha vez, Vou entrar em ação! E não existe nada que possa impedir quando Ele entra em ação, É no limite nosso que Ele diz, Eu posso e tenho a solução! Ele move barreiras, faz o impossível pra o filho Seu vencer! Tudo o que prometeu pra mim e pra você no momento d’Ele, Ele vai fazer! E não existe nada que possa impedir quando Ele entra em ação, É no limite nosso que Ele diz, Eu posso e tenho a solução! Ele move barreiras, faz o impossível pra o filho Seu vencer! Tudo o que prometeu pra mim e pra você no momento d’Ele, Ele vai fazer!      
274;6;O Cálice;301;Quando as dores da vida te ferem a alma E a cada dia as lutas apagam tua Fé... O mar se agita revolto e as ondas querendo te afogar! E todas as portas fecharam-se para você... Parece que Deus não escuta o teu lamento... E às vezes tu pensas em abandonar tua cruz... E chega a pensar que és o único que tens te sentido assim, O cálice amargo que bebes vai chegar ao fim! Saibas que Deus tem olhado o teu sofrimento! O teu lamento chegou ao Trono do Senhor! Deus tem estado ao teu lado em todo o tempo Na hora da angústia, na hora da dor! Saibas não há provação que dure pra sempre! E, depois da tempestade, o sol vai brilhar! Pois não há luta que dure por todo o tempo É Deus Quem te garante, a vitória vai chegar!     
275;6;O Grande;302;Qual é a idade do meu Deus? Seu aniversário que data é? Que carro Ele usa pra andar na terra? Que sapato cabe no Seu pé? Quantos metros têm a Sua casa? E em que faculdade Ele estudou? Qual o valor do Seu patrimônio? Qual o nome do Seu professor? Quem Lhe ensinou agronomia? E em direito é muito mais que bacharel Na palma da mão colhe as águas do mar E chama pelo nome cada estrela do céu! Não! Ele não dá a Sua glória a ninguém, Pois é dono de tudo e tudo Ele tem! Não aceita soberba e ao prepotente Ele faz descer! É dono do ouro e da prata, tudo é Seu! Incalculável é o tamanho do meu Deus! Ele não tem, Ele é o Próprio Poder! Por isso a glória é d’Ele, Tudo aqui é d’Ele! O Grande aqui é Ele, Aqui é tudo d’Ele! É pra Ele, É por Ele, É com Ele, É tudo d’Ele! Eu vim louvar a Ele, Quem mandou foi Ele! A promessa é d’Ele, Quem falou foi Ele! E quem não concordar com o que Ele faz vai reclamar com Ele! Eu vim louvar a Ele, Quem mandou foi Ele! A promessa é d’Ele, Quem falou foi Ele! E quem não concordar com o que Ele faz vai reclamar com Ele!   
276;6;O Jordão;303;OBS: Versão para ser usada com Playback Ao chegar ao rio, a jornada findar, A distância esta vida ficar. Haverá um amigo para me guiar, O Jordão eu não passarei só! O Jordão eu não passarei só, Jesus Cristo é meu guia eficaz. Quando as trevas eu ver, virá socorrer O Jordão eu não passarei só! Muitas vezes cansado e triste aqui, Parece amigos não ter Mas um pensamento alegria me dá, O Jordão eu não passarei só! O Jordão eu não passarei só, Jesus Cristo é meu guia eficaz. Quando as trevas eu ver, virá socorrer O Jordão eu não passarei só!     
277;6;O Nome Sobre Todo Nome;304;Forte, poderoso, é absoluto! Gerador da força que move todo o mundo! Estendeu o céu como cortina para habitar! Formou o grande exército de lindas estrelas, E chama cada uma pelo próprio nome! Acima da terra está sentado no Seu trono! Nem o mais lindo verso em melodia traduzirá um dia a grandeza que Ele é! Autoridade máxima na terra, no mar e no céu! Aquele que foi, sempre é, e será! El Shaddai, Elohim, Elyon, Adonai! Não há Deus como Ele, eu adoro só Ele! El Shaddai, Elohim, Elyon, Adonai, Mesmo sendo quem é posso tocá-Lo com minha fé Ele é Santo! Santo! Ele é Santo! Santo! Como cheiro suave respira o meu louvor! Ele é Santo! Grande! Poderoso! Altíssimo! O universo se rende a Ti em louvor! [2x] El Shaddai, Elohim, Elyon, Adonai! Não há Deus como Ele, eu adoro só Ele! El Shaddai, Elohim, Elyon, Adonai, Mesmo sendo quem é posso tocá-Lo com minha fé   
