Nº;Pasta;Título;Página;Letra
382;9;Pastor;412;Solo: Sua história é um exemplo pra mim... O seu testemunho tem me aproximado de Deus! Se eu viver mais de oitenta anos quero ser como você pastor... Solo: Sua casa testifica sobre quem você é! Sua obra, sua vida, seu amor, sua fé! Os meus filhos vão saber que se eu hoje adoro a Deus... É por tudo que você me ensinou... Profeta do Senhor! Todos: Homem de Deus! Escolhido pra curar as feridas da minha alma! Homem de fé! Que tem dedicado a mim o seu amor e proteção! Homem amado! Quando fala faz arder dentro de mim o coração! Pastor, você é o profeta da minha geração! (3x) Meninas: Oh! Por que Jesus me ama? Eu não posso t’explicar! Mas, a ti também te chama, Pois deseja te salvar. Homens: Eu quero mais e mais de Cristo, eu quero mais do Teu poder! Eu quero mais da Tua presença! Eu quero mais do Teu viver! Todos: Santo Espírito enche a minha vida, Pois com Cristo eu quero brilhar! Santo Espírito enche a minha vida, Usa-me as almas a salvar! Aleluia! Aleluia! Aleluia dou ao Cristo Rei! Aleluia! Aleluia! Aleluia Dou ao Rei! Homem de Deus! Escolhido pra curar as feridas da minha alma! Homem de fé! Que tem dedicado a mim o seu amor e proteção! Homem amado! Quando fala faz arder dentro de mim o coração! Pastor, você é o profeta da minha geração! (3x) 
383;9;Primeiro Amor;413;Quero voltar ao início de tudo, encontrar-me contigo Senhor... Quero rever meus conceitos e valores, eu quero reconstruir! Vou regressar ao caminho, volver às primeiras obras Senhor! Eu me arrependo Senhor! Me arrependo Senhor! (2x) Eu quero voltar Ao Primeiro Amor! Ao Primeiro Amor! Eu quero voltar a Deus! Quero voltar ao início de tudo, encontrar-me contigo Senhor... Quero rever meus conceitos e valores, eu quero reconstruir! Vou regressar ao caminho, volver às primeiras obras Senhor! Eu me arrependo Senhor! Me arrependo Senhor! (2x) Eu quero voltar Ao Primeiro Amor! Ao Primeiro Amor! Eu quero voltar a Deus!       
384;9;Promessa;414;Parece mesmo que esse dia nunca vai chegar... Parece mesmo que Suas promessas eu não vou viver... Possuir a terra onde há honra, leite e mel Com meus filhos ao redor, ver Suas bênçãos sobre os meus! [2x] Aqu’Ele que começou a boa obra em minha vida É Fiel, Ele É Fiel! Não descansará! Não desistirá enquanto não houver terminado! Não vivo do que vejo mas vivo do que creio e Ele É Fiel, sim Jesus É Fiel! Eu não morrerei... Antes viverei todo bem do Senhor aqui na terra e no céu! Uh, Uh, Uh, Uh... Uh, Uh, Uh, Uh... Uh, Uh, Uh, Ah...! Olhando para Ele eu entro em Seu altar... Sentindo o Seu Espírito queimando o coração! Pai das luzes que não muda continua a me dizer Que essa terra é minha e que nela eu vou viver! Aqu’Ele que começou a boa obra em minha vida É Fiel, Ele É Fiel! Não descansará! Não desistirá enquanto não houver terminado! Não vivo do que vejo mas vivo do que creio e Ele É Fiel, sim Jesus É Fiel! Eu não morrerei... Antes viverei todo bem do Senhor aqui na terra e no céu!    
385;9;Quão Grande é o meu Deus!;415;Quão grande é o meu Deus! Cantarei quão grande é o meu Deus! E todos hão de ver quão grande é o meu Deus! Com esplendor de um Rei em majestade e luz Faz a terra se alegrar! Faz a terra se alegrar! Ele É a própria Luz E as trevas vão fugir Tremer com Sua voz! Tremer com Sua voz! Quão grande é o meu Deus! Cantarei quão grande é o meu Deus! E todos hão de ver quão grande é o meu Deus! Por gerações Ele É, O tempo está em Suas mãos! O começo e o fim... O começo e o fim... Três se formam em Um: Filho, Espírito e Pai! Cordeiro e Leão! Cordeiro e Leão! Quão grande é o meu Deus! Cantarei quão grande é o meu Deus! E todos hão de ver quão grande é o meu Deus! Dueto: Sobre todo nome é o Seu! Tu És digno do louvor! Eu cantarei quão grande É o meu Deus É o meu Deus! Todos: Quão grande é o meu Deus! Cantarei quão grande é o meu Deus! E todos hão de ver quão grande é o meu Deus! Quão grande é o meu Deus! Cantarei quão grande é o meu Deus! E todos hão de ver quão grande é o meu Deus! [2x]    
386;9;Reina em mim;416;Reina em mim com o Teu poder sobre a escuridão, sobre os sonhos meus, Tu És o Senhor de tudo que sou, vem reinar em mim Senhor! Sobre toda a terra Tu És o Rei, Sobre as montanhas e o pôr do sol Uma coisa só meu desejo é, vem reinar em mim Senhor! Sobre o meu pensar, tudo o que eu falar, Faz-me refletir a beleza que há em Ti Tu És para mim mais que tudo aqui, vem reinar de novo em mim! Reina em mim com o Teu poder sobre a escuridão, sobre os sonhos meus Tu És o Senhor de tudo que sou, vem reinar em mim Senhor! Sobre o meu pensar, tudo o que eu falar, Faz-me refletir a beleza que há em Ti Tu És para mim mais que tudo aqui, vem reinar de novo em mim! Reina em mim com o Teu poder sobre a escuridão, sobre os sonhos meus Tu És o Senhor de tudo que sou, vem reinar em mim Senhor! Reina em mim com o Teu poder sobre a escuridão, sobre os sonhos meus Tu És o Senhor de tudo que sou, vem reinar em mim Senhor! [4x] Vem reinar em mim Senhor!    
387;9;Rendido Estou;417;Toma-me, rendido estou, aos pés da cruz me encontrei O que tenho Te entrego ó Deus! Vem limpar as minhas mãos, purificar meu coração Que eu ande em tudo que Tu tens pra mim! Oh, oh, oh, oh... Eis me aqui, rendido estou! Oh, oh, oh, oh... Eu sou Teu e Tu És meu, Jesus... Meus momentos e os dias meus Meu respirar e meu viver Que sejam todos, pra Ti ó Deus Oh, oh, oh, oh... Eis me aqui, rendido estou! Oh, oh, oh, oh... Eu sou Teu e Tu És meu... [2x] Oh, Oh, Oh, Oh, Oh! Minha vida dou a Ti, Senhor Rendido a Ti estou! E pra sempre cantarei faz em mim o Teu querer! [2x] Oh, oh, oh, oh... Eis me aqui, rendido estou! Oh, oh, oh, oh... Eu sou Teu e Tu És meu... [2x] Minha vida dou a Ti, Senhor Rendido a Ti estou! E pra sempre cantarei faz em mim o Teu querer! [2x]   
388;9;Ser Conhecido de Deus;418;Quero me apresentar a Ti ó Deus, Te ofertar em louvor! Me entregar, me derramar, os Teus planos cumprir! Que possas achar em mim a voz que deseja ouvir Que toca o Espírito, abre os céus e enche o Teu coração! Ser reconhecido, marcado por transformação Provado pelo fogo, Habilitado pela unção Sabe todos os meus dias que pra vida e para morte eu vou andar com Deus! O Senhor conhece os que são Seus! Ouve a voz sincera de um adorador Me separou, me marcou no Seu altar para servir! O Senhor conhece os que são Seus! Ouve a voz sincera de um adorador Me separou, me marcou no Seu altar para servir! [2x] 
389;9;Sinfonia;419;Que a minha vida seja um louvor a Ti... Cada momento um acorde especial! Cada mês um hino novo, cada ano uma sinfonia Que cante o Teu amor, Jesus... Que eu seja um instrumento afinado por Ti No tom da especial adoração! Fortalezas cairão! Portas do inferno tremerão! E demônios pela unção deste louvor vão recuar! [2x] Cordeiro de Deus, Rei dos reis e Senhor! A Ti toda honra, glória e todo louvor! Poder e Majestade, Força e Alegria pertencem a Ti, ó Rei Jesus! Eu Te amo, Te adoro, Te adoro ó Rei Jesus! Te amo, Te adoro, Te adoro ó Rei Jesus! Quero viver pra Te louvar e Te adorar ó Rei Jesus! Te amo e Te adoro... (3x) Ó Rei Jesus! [2x] Solo: Que a minha vida seja um louvor a Ti...    
390;9;Sopra Espírito!;420;Solo: Com Teu vento vem soprar sobre nós, Sobre o vale de ossos secos Espírito de Deus [2x] Pela fé eu posso ouvir a glória encher esse lugar Da fraqueza um forte exército levantar Todos: Profetiza, ó filho do homem Vem dos quatro ventos ó Espírito de Deus! E assopra sobre esse vale, um ruído e um rebuliço eu já posso ouvir! Sopra! Vento de Deus! Sopra! Preciso de Ti! Sopra! Sopra! Poderoso, Onisciente, Onipresente, Emanuel! Santo e Consolador, Espírito de Deus! Vem encher, fortalecer, Vem curar, vem soprar, Derramar, vem visitar Vento de Deus! Profetiza, ó filho do homem Vem dos quatro ventos ó Espírito de Deus! E assopra sobre esse vale, um ruído e um rebuliço eu já posso ouvir! Sopra! Vento de Deus! Sopra! Preciso de Ti! Sopra! Sopra! Poderoso, Onisciente, Onipresente, Emanuel! Santo e Consolador, Espírito de Deus! Vem encher, fortalecer, vem curar, vem soprar, Derramar, vem visitar Vento de Deus! Sopra! (5x) Vento de Deus!!! 
391;9;Terremoto;421;Seja qual for o teu problema amigo, eu te convido a adorar comigo! Porque toda vez que um louvor alcança o trono do Senhor, Um terremoto vem anunciar que sempre vale a pena adorar... A prisão não é eterna, vai passar e quem crê jamais desiste de cantar! Porque toda vez que uma canção é transformada em oração, Um terremoto vem anunciar que sempre vale a pena adorar! Um terremoto vai acontecer aqui e as cadeias que me cercam vão cair! Quando não há o que fazer e é muito forte a minha dor Levanto as mãos pro céu e louvo ao Senhor! A meia noite cantarei uma canção... Tão alto que os prisioneiros ouvirão! Um terremoto vai acontecer e o inimigo vai ceder, Porque não há cadeias onde há adoração! Aleluia, Aleluia... (8x) Um terremoto vai acontecer aqui e as cadeias que me cercam vão cair! Quando não há o que fazer e é muito forte a minha dor Levanto as mãos pro céu e louvo ao Senhor! A meia noite cantarei uma canção... Tão alto que os prisioneiros ouvirão! Um terremoto vai acontecer e o inimigo vai ceder, Porque não há cadeias onde há adoração! Porque não há cadeias... Porque não há cadeias... Porque não há cadeias onde há adoração... Onde há adoração!   
392;9;Teu Deus, teu Senhor;422;É preciso confiar em Seu amor, É preciso acreditar em Seu poder Deus é o mesmo não mudou, creia você vai vencer! Deus fará um novo dia pra você! Por maior que seja a tua provação Tenhas fé, Deus pode tudo resolver! Não existe impossível, para Deus, meu irmão! Deus coloca agora a benção em tuas mãos! Ele te levanta do pó! Faz brilhar o sol sobre ti! Te protege a cada manhã, Seu cuidado nunca tem fim! Ele ouve sempre tua voz quando você clama na dor, Sempre estará com você, Ele é teu Deus, teu Senhor! O teu Senhor... Por maior que seja a tua provação Tenhas fé, Deus pode tudo resolver! Não existe impossível, para Deus, meu irmão! Deus coloca agora a benção em tuas mãos! Ele te levanta do pó! Faz brilhar o sol sobre ti! Te protege a cada manhã, Seu cuidado nunca tem fim! Ele ouve sempre tua voz quando você clama na dor, Sempre estará com você, Ele é teu Deus, teu Senhor! O teu Senhor... [2x] Ele ouve sempre tua voz quando você clama na dor, Sempre estará com você, Ele é teu Deus, teu Senhor! O teu Senhor...   
393;9;Tu És Santo (Príncipe da paz);423;Tu És Santo! Poderoso Tu És Digno De adoração Eu Te sigo Eu Te ouço Para sempre Te amarei! Ele é o meu Senhor Ele é o Rei dos reis Ele é o Pai de amor Poderoso Deus! É o Emanuel  É o Grande Eu Sou Ele É o Cordeiro que me salvou! Ele Vivo Está Ele ressurgiu! Sempre reinará Ele sempre existiu! Ele é o Alfa, o Ômega Início e Fim! Salvador e Messias Amigo pra mim! E eu canto E louvo Ao Rei que É Digno! Eu O amo E adoro Diante d’Ele eu Me prostro E eu canto E louvo Ao Rei que É Digno! Eu O amo E adoro Diante d’Ele eu Me prostro Todos: Príncipe da Paz! Só por Ele eu viverei! Príncipe da Paz! Só por Ele eu viverei! Ele é o meu Senhor, Ele é o Rei dos reis Ele é o Pai de amor, Poderoso Deus! É o Emanuel, É o Grande Eu Sou Ele é o Cordeiro, Que me salvou! Ele Vivo Está, Ele ressurgiu! Sempre reinará, Ele sempre existiu! Ele é o Alfa, o Ômega Início e Fim! Salvador e Messias Amigo pra mim! Príncipe da Paz! Só por Ele eu viverei! (2x) Oh... Oh... Oh.... (4x)
394;9;Verei Jesus;425;Almejo o dia em que verei uma pequena luz no céu! E essa luz aumentará, milhares de anjos surgirão! Eu creio sim que Ele virá E muito em breve eu subirei Pra um novo lar, um novo céu! Pra sempre eu estarei, feliz eu viverei! Verei Jesus! A voz de Deus irá soar, nas nuvens Sua glória surgirá! Mil gerações se encontrarão e para sempre louvarão Eu creio sim que Ele virá E muito em breve eu subirei Pra um novo lar, um novo céu! Pra sempre eu estarei, feliz eu viverei! Verei Jesus! Eu creio sim que Ele virá E muito em breve eu subirei Pra um novo lar, um novo céu! Pra sempre eu estarei, feliz eu viverei... [2x] Verei Jesus!     
395;9;Vou com Jesus;426;Vou com Jesus! Ninguém pode me parar! Vou com Jesus! Voooou... Ninguém pode me parar! (2x) Vou com Jesus! Ninguém pode me parar! Vou com Jesus! Voooou... Ninguém pode me parar! (2x) Sop: Numa bela manhã ressuscitou, Todos: Ressuscitou! Sop: Numa bela manhã ressuscitou, ressuscitou... Con: Numa bela manhã ressuscitou, Todos: Ressuscitou! Con: Numa bela manhã ressuscitou, ressuscitou... Ten: Foi ao céu e um dia voltará, Todos: Voltará! Ten: Foi ao céu e um dia voltará, voltará... Todos: Foi ao céu e um dia voltará, voltará! Foi ao céu e um dia voltará, voltarááááÁ... Estou me preparando para subir com Ele! Ninguém pode me parar! Vooooou... Ninguém pode me parar! Verei Jesus sentado ao lado de Deus! Ninguém pode me parar! Vooooou...Ninguém pode me parar! Andarei com Ele nas ruas de ouro! Ninguém pode me parar! Vooooou... Ninguém pode me parar! Não... pode me parar! Vooooou... Ninguém pode me parar (2x) Não.... 
396;10;Amanhã;427;Amanhã eu não sei o que virá O que acontecerá aos meus sonhos tão diversos Amanhã o meu ser se alegrará ou tristonho ficará O amanhã eu não sei... Qual será o futuro pra você se não se arrepender Dessas coisas tão errôneas? Qual será nesta vida o seu fim se continuar assim? Volte logo para Deus! Como será o amanhã? Será feito de sofrer ou delícias e prazer? Qual será seu horizonte final? Como explicar seu proceder? Nossa vida é um farol, Resplandece a luz do sol ou então fica sem brilho! Volte logo pra Deus! Deixa este mundo mau Venha ser como eu! Volte logo pra Deus! [2x]      
397;10;Apenas Servo;428;Senhor, às vezes penso que estou só na caminhada Como é tão dura e difícil a jornada! Nem sempre forte eu me sinto pra seguir... Senhor, quantos me olham e criticam meus fracassos Não sabem eles que seguindo estou Teus passos, Sou imperfeito, porém Tu Senhor és forte! Senhor, é na fraqueza minha que Tua mão me toca! Não sou, porém Tu És e isso é o que importa! Apenas servo sou... Teu servo e nada mais! Senhor! Mas quem sou eu pra imaginar que sou? Tu És em mim! E enquanto assim pensar mais perto eu estarei de Ti! Mesmo sendo o que sou, sou servo Teu, Senhor! Senhor, quantos gigantes me perseguem no caminho Como vencê-los se me sinto tão sozinho? Eles são muitos, verdadeira multidão! Senhor, eles vêm vindo todos muito bem armados Pra enfrentá-los tenho que estar preparado Transforma essa fraqueza em força ainda hoje! Senhor, é na fraqueza minha que Tua mão me toca! Não sou, porém Tu És e isso é o que importa! Apenas servo sou... Teu servo e nada mais! Senhor! Mas quem sou eu pra imaginar que sou? Tu És em mim! E enquanto assim pensar mais perto eu estarei de Ti! Mesmo sendo o que sou, sou servo Teu, Senhor!   
398;10;Calvário;429;Você pode estar buscando felicidade E até mesmo riquezas também E o Senhor preparou para nós O calvário, monte de salvação! Calvário! Monte de redenção! Muitos foram ali receber perdão Calvário! Monte de esperança! Quem por ali passar lá no céu vai morar. Você nunca andou por ali Nem seus olhos viram a velha cruz Mas o seu coração nunca esquecerá O encontro com o monte de salvação! Calvário! Monte de redenção! Muitos foram ali receber perdão Calvário! Monte de esperança! Quem por ali passar lá no céu vai morar. [2x]      
399;10;Casa do Oleiro;430;Deus não há como descrever Tua grandeza e Teu poder Não há outro igual a Ti! Sim, quando desço reconheço Que foi pago um alto preço por mim! Eu vou descer à casa do Oleiro E o meu Senhor irá me refazer! Eu vou descer pra glória e honra d’Ele Eu vou descer pra Deus aparecer! Deus não há como descrever Tua grandeza e Teu poder Não há outro igual a Ti! Sim, quando desço reconheço Que foi pago um alto preço por mim! Eu vou descer à casa do Oleiro E o meu Senhor irá me refazer! Eu vou descer pra glória e honra d’Ele Eu vou descer pra Deus aparecer! [2x] Eu Te dou glória! Eu Te dou glória! Eu Te dou glória pra todo sempre, amém!     
400;10;Cem Ovelhas;431;Eram cem ovelhas juntas no aprisco Eram cem ovelhas que amante cuidou Porém numa tarde ao contá-las todas Lhe faltava uma, lhe faltava uma e triste chorou! As noventa e nove deixou no aprisco E pelas montanhas a buscá-la foi! A encontrou gemendo, tremendo de frio Curou suas feridas, pôs logo em seus ombros e ao redil voltou! Essa mesma história volta a repetir-se Pois muitas ovelhas perdidas estão! Mas ainda hoje o Pastor amado Chora suas feridas, chora suas feridas e quer te salvar! As noventa e nove deixou no aprisco E pelas montanhas a busca-la foi! A encontrou gemendo, tremendo de frio Curou suas feridas, pôs logo em seus ombros e ao redil voltou!      
401;10;Deus Cuida de ti;432;Olhe para as aves do céu não semeiam e nem colhem, Mas Deus delas cuida mui bem! Olhe para os lírios do campo, Não tecem e nem fiam e Deus os cobre de glórias também! Não tendes vós muito mais valor do que isso? Acredite nisso, Deus cuida de você! Deus cuida de ti isto é certo, Ele é fiel! Pode ficar descansado é promessa do céu! Se até dos pardais Ele cuida com os carinhos seus, Cuida de ti muito mais, és um filho de Deus! Vives lamentando a sorte te amedronta a morte, São longos os dias do mal... Há uma luz que ainda brilha lá no fim da estrada Prometendo um alegre final! Se creres que Deus sempre está por perto Podes ficar certo Ele cuida de você. Deus cuida de ti isto é certo, Ele é fiel! Pode ficar descansado é promessa do céu! Se até dos pardais Ele cuida com os carinhos seus, Cuida de ti muito mais, és um filho de Deus!     
402;10;Deus Enxuga teu Pranto;433;Hoje há muita indiferença e tanta descrença a nos rodear, Tanta gente está sofrendo, outros vão morrendo sem encontrar paz... Há aquele que insiste mesmo estando triste em continuar Pois aguarda um novo dia quando em alegria poderá cantar! O choro pode durar uma noite! Uma noite o choro pode durar! Mas de manhãzinha a alma se alegra E Deus vem o teu pranto enxugar! A noite tão escura e fria que antecede o dia parece não ter fim E o crente triste e aflito Pensa “Jesus Cristo se esqueceu de mim!” Mas a noite logo passa e a manhã de graça começa a raiar Ele lembra da promessa ela nunca cessa, firme sempre está! O choro pode durar uma noite! Uma noite o choro pode durar! Mas de manhãzinha a alma se alegra E Deus vem o teu pranto enxugar!      
403;10;Deus Muda Situações...;434;"Está difícil... Está fechado o teu caminho em toda direção... Não tem jeito, sempre alguém está dizendo, “Não há solução!” Mas Deus muda num instante a sua vida se assim você crer! Faz você mudar, derruba muralhas, Deus é Deus, igual a Deus não há! Muda a sua, muda a minha, muda a nossa Com esse Deus tremendo não há quem possa! Se hoje Deus tomar lugar em sua vida verá que existe solução! Deus é Deus e vai mudar sua situação! Alguém disse: “É o fim da sua vida; você perdido está.” Não, não aceite, diga: “Agora estou liberto! Deus vai me ajudar.” Esse medo que aos poucos vai tomando o seu coração, Deixe-o sair! Deus hoje ainda, vai mudar sua situação! Muda a sua, muda a minha, muda a nossa Com esse Deus tremendo não há quem possa! Se hoje Deus tomar lugar em sua vida verá que existe solução! Deus é Deus e vai mudar sua situação! [2x] Deus é Deus e vai mudar sua situação!     "
404;10;Ei, você...;435;Ei, você que anda triste e abatido, o teu semblante está caído E você diz a vida é mesmo assim... Ei, você que só insiste em andar triste, amor em ti já não existe... Isso não é o fim! Ei, você que já não tem mais alegria Está raiando um novo dia, o sol começa a aparecer! Pra você a solução chegou agora! Não, não sai assim, não vai embora! Jesus quer te socorrer! [2x]         
405;10;És...;436;És o orvalho que nutre uma rosa, És a rosa que enfeita o jardim, És jardim que ornamenta a campina, És o campo radioso sem fim! És o raio de luz dentre as sombras, És a sombra suave e fiel, És o manto azulado do espaço, És o braço que me une aos céus! És o sonho ideal da poesia! Que irradia na rima do verso Na candura do meu dia a dia, O segredo total do universo! És o berço que embala a criança que nasce És a face alegre da alma remida! És degrau para a eterna subida És a vida meu Deus! És a vida! És a ponte que jaz sobre o abismo, És a fonte dos mananciais, És o doce marulho das águas, No deserto és recanto de paz! Tu que reinas acima da morte És o forte que sustenta a cruz És o norte que orienta o filho És o brilho no olhar de Jesus! És o sonho ideal da poesia! Que irradia na rima do verso Na candura do meu dia a dia, O segredo total do universo! És o berço que embala a criança que nasce És a face alegre da alma remida! És degrau para a eterna subida És a vida meu Deus... És a ponte que jaz sobre o abismo, És a fonte dos mananciais, És o doce marulho das águas, No deserto és recanto de paz! Tu que reinas acima da morte És o forte que sustenta a cruz És o norte que orienta o filho És o brilho no olhar de Jesus!         
406;10;Fiel a Mim;438;Sei que estás aqui Senhor, podes perceber quem sou Podes ver se há em mim um verdadeiro adorador A minha oferta eu ofereço a Ti, Deus meu Pra reconhecer que nada tenho, tudo é Teu! Quero Te adorar, ainda que a figueira não floresça! Quero me alegrar, mesmo se o dinheiro me faltar! A vitória vem, mesmo que pareça que é o fim Pois Tu és fiel Senhor, fiel a mim! Tu és fiel Senhor, eu sei que Tu és fiel! (2x) E ainda que eu não mereça permaneces assim Fiel, Senhor meu Deus, fiel a mim... (2x) A minha oferta eu ofereço a Ti, Deus meu Pra reconhecer que nada tenho, tudo é Teu! Quero Te adorar, ainda que a figueira não floresça! Quero me alegrar, mesmo se o dinheiro me faltar! A vitória vem, mesmo que pareça que é o fim Pois Tu és fiel Senhor, fiel a mim! Tu és fiel Senhor, eu sei que Tu és fiel! (2x) E ainda que eu não mereça permaneces assim Fiel, Senhor meu Deus, fiel a mim... (2x)    
407;10;Há uma Saída;439;Bem distante eu te vi parado a beira do caminho... Cabisbaixo e sem direção se sentindo tão sozinho! Coração angustiado em seu peito! Você vive maus momentos! É todo dia a mesma coisa e você se cansou de tanto sofrimento! Mas eu declaro que chegou a hora e Deus vai tirar você desse vento! Se a fúria do inimigo contra ti se levantar... Ele ordena anjos poderosos para te guardar! Foi ungido, foi remido, separado pra vencer e reinar com Ele! Deus vai na frente garantindo a vitória para os filhos Seus! Quebrando as correntes, sujeitando os inimigos porque Ele é Deus! Faz sair água da rocha, com esse Deus não há quem possa! Não há como nosso Deus! Lá no Egito trouxe as pragas e humilhou um tal de Faraó! Exaltou a Israel e fez saber que aquele povo não estava só! Faz a morte virar vida! Pra tudo tem uma saída! Não há como nosso Deus! Elohim, El Shaddai, Adonai! Adore o nome d’Ele! Ele é Deus verdadeiro! Ele te amou primeiro! Te levanta desse chão! Elohim, El Shaddai, Adonai! Adore o nome d’Ele! Faz a morte virar vida! Pra tudo tem uma saída! Faz de ti um campeão! Deus vai na frente garantindo a vitória para os filhos Seus! Quebrando as correntes, sujeitando os inimigos porque Ele é Deus! Faz sair água da rocha, com esse Deus não há quem possa! Não há como nosso Deus! Lá no Egito trouxe as pragas e humilhou um tal de Faraó! Exaltou a Israel e fez saber que aquele povo não estava só! Faz a morte virar vida! Pra tudo tem uma saída! Não há como nosso Deus! Elohim, El Shaddai, Adonai! Adore o nome d’Ele! Ele é Deus verdadeiro! Ele te amou primeiro! Te levanta desse chão! Elohim, El Shaddai, Adonai! Adore o nome d’Ele! uma saída! Faz de ti um campeão! 
408;10;Jesus é o meu Refúgio;440;Jesus é o meu refúgio em toda tempestade Ele é a rocha firme por toda eternidade Ele em tudo me envolve e me arrebatará Jesus é o meu refúgio, Jesus é o meu refúgio, Nada me faltará! (2x) As turbulentas ondas se aumentam sobre mim E a escura noite já quer me encobrir! Meu barco navegando rumo ao porto está Jesus é o meu piloto, Jesus é o meu piloto, Seguro vou chegar! (2x) Jesus é a esperança de toda a humanidade Ele é a medicina pra toda a enfermidade Não temerei a morte Ele me guardará! Jesus é a esperança, Jesus é a esperança, N’Ele vou confiar! (3x)       
